Spatio-temporal patterns of wildfires in Siberia during 2001-2020,"Vladimir Solovyev, Oleg Tomshin",Geocarto International,37,25,p7339 - p7357,2022,10.1080/10106049.2021.1973581,06-Sep-2021,https://doi.org/10.1080/10106049.2021.1973581,982.0,29.0
The Food Habits of Some Wild Ungulates in Relation to Land Use and Management,C R Field,East African Agricultural and Forestry Journal,33,sup1,p159 - p162,1968,10.1080/00128325.1968.11665308,08-Jan-2016,https://doi.org/10.1080/00128325.1968.11665308,4.0,6.0
"Plant community composition, tree physiology, and bark-beetle mortality in relation to open and enclosed irrigation channels: a case study within a wildland-urban interface forest in western Montana",Eric G Keeling,Écoscience,25,2,p163 - p177,2018,10.1080/11956860.2018.1435064,21-Feb-2018,https://doi.org/10.1080/11956860.2018.1435064,116.0,1.0
What Influences Hazard Mitigation? Household Decision Making About Wildfire Risks in Arizona's White Mountains∗,Timothy W Collins,The Professional Geographer,60,4,p508 - p526,2008,10.1080/00330120802211737,17-Sep-2008,https://doi.org/10.1080/00330120802211737,1800.0,111.0
Wildfire smoke reduces Little Eagle (Hieraaetus morphnoides) flight activity,"Renee Brawata, Micah Davies, Jaimie Hopkins, Stuart Rae, Claire Wimpenny",Emu - Austral Ornithology,123,4,p357 - p363,2023,10.1080/01584197.2023.2267609,30-Oct-2023,https://doi.org/10.1080/01584197.2023.2267609,946.0,3.0
The vulnerability of water supply catchments to bushfires: impacts of the January 2003 wildfires on the Australian Capital Territory,"Trevor Daniell, Norm Mueller, Alan Wade, Robert Wasson, Ian White, Martin Worthy",Australasian Journal of Water Resources,10,2,p179 - p194,2006,10.1080/13241583.2006.11465291,11-Nov-2015,https://doi.org/10.1080/13241583.2006.11465291,873.0,35.0
The use of wild foods during periods of food shortage in rural Zimbabwe,"D J Campbell, T Matiza, L M Zinyama",Ecology of Food and Nutrition,24,4,p251 - p265,1990,10.1080/03670244.1990.9991144,31-Aug-2010,https://doi.org/10.1080/03670244.1990.9991144,61.0,34.0
Beyond the spectacle: everyday witnessing for we that are here,Julie Vulcan,Continuum,38,1,p84 - p97,2024,10.1080/10304312.2023.2286197,27-Nov-2023,https://doi.org/10.1080/10304312.2023.2286197,874.0,1.0
Invasive Shrubs and Forest Tree Regeneration,Richard L Boyce,Journal of Sustainable Forestry,28,1-2,p152 - p217,2009,10.1080/10549810802626449,26-Feb-2009,https://doi.org/10.1080/10549810802626449,451.0,18.0
"Predictive rebound & technologies of engagement: science, technology, and communities in wildfire management",Eric B Kennedy,Journal of Responsible Innovation,7,sup1,p104 - p111,2020,10.1080/23299460.2020.1844954,02-Dec-2020,https://doi.org/10.1080/23299460.2020.1844954,1299.0,4.0
Chapter 5. Modeling Biotic Habitat High Risk Areas,"Paul Beier, Don G Despain, Bruce M Durtsche, Tom Stephens, Cathy Tate",Journal of Sustainable Forestry,11,1-2,p89 - p117,2000,10.1300/j091v11n01_05,17-Oct-2008,https://doi.org/10.1300/j091v11n01_05,40.0,1.0
Disturbance-Informed Annual Land Cover Classification Maps of Canada's Forested Ecosystems for a 29-Year Landsat Time Series,"Nicholas C Coops, Txomin Hermosilla, Geordie W Hobart, Joanne C White, Michael A Wulder",Canadian Journal of Remote Sensing,44,1,p67 - p87,2018,10.1080/07038992.2018.1437719,29-Mar-2018,https://doi.org/10.1080/07038992.2018.1437719,15916.0,184.0
Historical and Anticipated Changes in Forest Ecosystems of the Inland West of the United States,"Allan N D Auclair, W Wallace Covington, Tom A Daer, Richard L Everett, Larry L Irwin, Robert Steele",Journal of Sustainable Forestry,2,1-2,p13 - p63,1994,10.1300/j091v02n01_02,18-Oct-2008,https://doi.org/10.1300/j091v02n01_02,136.0,130.0
A reactive nitrogen budget for forest land and wetlands in Latvia and Estonia,"Arta Bārdule, Arvo Iital, Ilze Kārkliņa, Dagnija Lazdiņa, Zane Lībiete",Scandinavian Journal of Forest Research,35,8,p513 - p522,2020,10.1080/02827581.2020.1825788,30-Sep-2020,https://doi.org/10.1080/02827581.2020.1825788,216.0,1.0
"Simulation of land use/cover dynamics in the Yayo coffee Forest biosphere reserve, southwestern Ethiopia","Bernard Nuoleyeng Baatuuwie, Gemeda Terfassa Fida, Hamza Issifu",Geocarto International,38,1,,2023,10.1080/10106049.2023.2256303,05-Sep-2023,https://doi.org/10.1080/10106049.2023.2256303,1246.0,5.0
"Migration, Land Acquisition and Bundle of Rights: The Case of Selected Community-based Forest Management Projects in Nueva Vizcaya, Philippines","Elizabeth T Carig, J G Carig",Journal of Sustainable Forestry,41,3-5,p370 - p385,2022,10.1080/10549811.2021.1935276,08-Jun-2021,https://doi.org/10.1080/10549811.2021.1935276,299.0,1.0
Impact of research and technical change in wildland recreation: Evaluation issues and approaches,"David N Bengston, Zhi Xu",Leisure Sciences,15,4,p251 - p272,1993,10.1080/01490409309513206,13-Jul-2009,https://doi.org/10.1080/01490409309513206,23.0,2.0
Use of Normalized Difference Water Index for monitoring live fuel moisture,"P E Dennison, S H Peterson, J Rechel, D A Roberts",International Journal of Remote Sensing,26,5,p1035 - p1042,2005,10.1080/0143116042000273998,15-Aug-2006,https://doi.org/10.1080/0143116042000273998,1142.0,102.0
Urban Vulnerability in Sydney: Policy and Institutional Ambiguities in Bushfire Protection,Mike Gillen,Urban Policy and Research,23,4,p465 - p476,2005,10.1080/08111140500400331,17-Aug-2006,https://doi.org/10.1080/08111140500400331,466.0,3.0
Pyrocumulonimbus: When Fires Create Their Own Weather,Richard A Lovett,Weatherwise,74,6,p14 - p20,2021,10.1080/00431672.2021.1973860,09-Nov-2021,https://doi.org/10.1080/00431672.2021.1973860,306.0,2.0
"Dynamic atmospheric transmission monitoring of Australian bushfires based on WAD-SNet, a SpaceBorne LiDAR hierarchical classification network","Hui Lu, Qingkai Lu, Chen Ma, Fan Mo, Jianjun Wu, Haobin Xia, Nan Xu, Jiaqi Yao, Han-Su Zhang, Siqin Zhang",GIScience & Remote Sensing,62,1,,2025,10.1080/15481603.2025.2548070,19-Aug-2025,https://doi.org/10.1080/15481603.2025.2548070,975.0,0.0
The Fiery Horse: A Russian Fairytale,Regina Abt,Psychological Perspectives,53,3,p335 - p371,2010,10.1080/00332925.2010.501231,01-Sep-2010,https://doi.org/10.1080/00332925.2010.501231,245.0,0.0
Spatiotemporal characteristics and driving factors of wildfires on the Qinghai-Tibetan Plateau,"Qiong Chen, Ruishan Chen, Xiaona Guo, Nansha Sun, Lilin Zheng, Zhenju Zhou","Geomatics, Natural Hazards and Risk",16,1,,2025,10.1080/19475705.2025.2579748,16-Nov-2025,https://doi.org/10.1080/19475705.2025.2579748,422.0,0.0
High-resolution multispectral satellite image and a postfire ground survey reveal prefire beetle damage on snags in Southern Alaska,"Naoto Kamata, Kobayashi Makoto, Hiroshi Tani",Scandinavian Journal of Forest Research,28,6,p581 - p585,2013,10.1080/02827581.2013.793387,22-May-2013,https://doi.org/10.1080/02827581.2013.793387,141.0,5.0
'Planting Seeds/The Fires of War',Shela Sheikh,Third Text,32,2-3,p200 - p229,2018,10.1080/09528822.2018.1483899,18-Jul-2018,https://doi.org/10.1080/09528822.2018.1483899,1522.0,0.0
Spatial and temporal scale issues in determining biomass burning regimes in Bolivia and Peru,"A V Bradley, A C Millington",International Journal of Remote Sensing,27,11,p2221 - p2253,2006,10.1080/01431160500396550,22-Feb-2007,https://doi.org/10.1080/01431160500396550,321.0,28.0
Mapping a burned forest area from Landsat TM data by multiple methods,"C X Cao, W Chen, L Koyama, K Moriya, T Sakai","Geomatics, Natural Hazards and Risk",7,1,p384 - p402,2016,10.1080/19475705.2014.925982,16-Jun-2014,https://doi.org/10.1080/19475705.2014.925982,7615.0,33.0
Ten years of forest cover change in the Sierra Nevada detected using Landsat satellite image analysis,Christopher Potter,International Journal of Remote Sensing,35,20,p7136 - p7153,2014,10.1080/01431161.2014.968687,22-Oct-2014,https://doi.org/10.1080/01431161.2014.968687,426.0,14.0
Monitoring the spatial spillover effects of wildfire carbon emissions and urban settlements on biodiversity loss in sub-Saharan Africa,"Mohammed Alnour, Sana Fatima, Md Emran Hossain, Shamsa Kanwal, Mohd Ziaur Rehman, Abdullah Önden",International Journal of Sustainable Development & World Ecology,32,7,p757 - p774,2025,10.1080/13504509.2025.2557199,09-Sep-2025,https://doi.org/10.1080/13504509.2025.2557199,173.0,2.0
Effect of the COVID-19 Pandemic on Protected Areas,"Anupam Anand, Geeta Batra, Jeneen Reyes Garcia, Jose Miguel Lopez Beltran, Neeraj Kumar Negi, Nathaniel Paul Robinson, Juha Ilari Uitto",Annals of the American Association of Geographers,115,10,p2554 - p2569,2025,10.1080/24694452.2025.2562528,10-Oct-2025,https://doi.org/10.1080/24694452.2025.2562528,166.0,0.0
Interpretation of land cover changes using aerial photography and satellite imagery in the Foothills Model Forest of Alberta,"Steven E Franklin, Peter K Montgomery, Gordon B Stenhouse",Canadian Journal of Remote Sensing,31,4,p304 - p313,2005,10.5589/m05-015,02-Jun-2014,https://doi.org/10.5589/m05-015,138.0,5.0
Awareness of wildfire smoke among U.S. adults with and without asthma,"Scott A Damon, Tia C Dowling, Lauren Freelander, Maria C Mirabelli, Audrey F Pennington",Journal of Asthma,62,8,p1431 - p1438,2025,10.1080/02770903.2025.2487994,04-Apr-2025,https://doi.org/10.1080/02770903.2025.2487994,203.0,0.0
Exploring household preferences for ecosystem services as a basis for strategic land use and conservation planning,"Michael Epprecht, Andreas Heinimann, Madlaina Michelotti, Phetsaphone Thanasack, Julie G Zaehringer",Ecosystems and People,22,1,,2026,10.1080/26395916.2025.2611227,12-Jan-2026,https://doi.org/10.1080/26395916.2025.2611227,861.0,0.0
Factors influencing support for bat management and conservation in the wildland-urban interface,"Carol L Chambers, Catrin M Edgeley, Martha E Lee, Michael A Petriello",Human Dimensions of Wildlife,28,2,p170 - p186,2023,10.1080/10871209.2021.2018630,26-Dec-2021,https://doi.org/10.1080/10871209.2021.2018630,375.0,1.0
"Forest planning across Europe: the spatial scale, tools, andinter-sectoral integration in land-use planning","Andrej Bončina, Sonia M Carvalho-Ribeiro, Christophe Chauvin, Sebastiano Cullotta, Christine Farcy, Mikko Kurttila, Federico G Maetzke",Journal of Environmental Planning and Management,58,8,p1384 - p1411,2015,10.1080/09640568.2014.927754,18-Jun-2014,https://doi.org/10.1080/09640568.2014.927754,581.0,16.0
Native American landscape modification in pre-settlement south-west Georgia,"Rachel R Fern, Max A Morris, Brandon T Rutledge, Jonathan M Stober",Landscape History,41,1,p57 - p68,2020,10.1080/01433768.2020.1753983,24-Apr-2020,https://doi.org/10.1080/01433768.2020.1753983,238.0,9.0
Analysis of wildfires and associated emissions during the recent strong ENSO phases in Southern Africa using multi-source remotely-derived products,"Mahlatse Kganyago, Lerato Shikwambana, Sifiso Xulu",Geocarto International,37,27,p16654 - p16670,2022,10.1080/10106049.2022.2113449,23-Aug-2022,https://doi.org/10.1080/10106049.2022.2113449,3228.0,16.0
Social Dynamics of the Value of Wild Edible Leaves (Imifino) in a South African Rural Area,Thembela Kepe,Ecology of Food and Nutrition,47,6,p531 - p558,2008,10.1080/03670240802209499,02-Dec-2008,https://doi.org/10.1080/03670240802209499,141.0,6.0
Burned area mapping across the Arctic-boreal zone with Landsat and Sentinel-2 imagery,"Logan T Berner, Arden Burrell, Andrew A Clelland, Scott J Goetz, Michelle C Mack, Susan M Natali, Stefano Potter, James T Randerson, Brendan M Rogers, Anna Talucci, Sander Veraverbeke, Xanthe J Walker, Yili Yang",International Journal of Remote Sensing,,,p1 - p29,5187,10.1080/01431161.2026.2639127,05-Mar-2026,https://doi.org/10.1080/01431161.2026.2639127,395.0,0.0
"Historical trends of degradation, loss, and recovery in the tropical forest reserves of Ghana","Jacob Amoako, Francis K Dwomoh, Andrea McMahon, Foster Mensah, Dawn M Nekorchuk, Izaya Numata, Michael C Wimberly",International Journal of Digital Earth,15,1,p30 - p51,2022,10.1080/17538947.2021.2012533,04-Feb-2022,https://doi.org/10.1080/17538947.2021.2012533,5336.0,23.0
Listening to the Land: The Selway-Bitterroot Wilderness as Oral History,Debbie Lee,The Oral History Review,37,2,p235 - p248,2010,10.1093/ohr/ohq093,01-Dec-2019,https://doi.org/10.1093/ohr/ohq093,84.0,1.0
"Wildfire susceptibility mapping by incorporating damage proxy maps, differenced normalized burn Ratio, and deep learning algorithms based on sentinel-1/2 data: a case study on Maui Island, Hawaii","BongChan Kim, Chang-Wook Lee, Sungjae Park, Suci Ramayanti",GIScience & Remote Sensing,61,1,,2024,10.1080/15481603.2024.2353982,14-May-2024,https://doi.org/10.1080/15481603.2024.2353982,2781.0,12.0
Ethnobotanical and chemical surveys of an edible wild legume: Uraria Picta (Jacq.) DC.,"Guy-Alain Ambé, Georges Lognay, François Malaisse, Bernard Wathelet",Ecology of Food and Nutrition,40,5,p545 - p565,2001,10.1080/03670244.2001.9991666,31-Aug-2010,https://doi.org/10.1080/03670244.2001.9991666,88.0,2.0
Slash-burning in the regeneration of dry eucalypt forests,"D M J S Bowman, W D Jackson",Australian Forestry,44,2,p118 - p124,1981,10.1080/00049158.1981.10674302,15-Apr-2013,https://doi.org/10.1080/00049158.1981.10674302,22.0,7.0
Remotely sensed digital data in forestry: a review,"K R Shepherd, A K Skidmore, G B Wood",Australian Forestry,50,1,p40 - p53,1987,10.1080/00049158.1987.10674493,15-Apr-2013,https://doi.org/10.1080/00049158.1987.10674493,21.0,6.0
A Child's Eye View of Where the Wild Things Are: Lessons from Spike Jonze's Film Adaptation of Maurice Sendak's Picture Book,Sarah Annunziato,Journal of Children and Media,8,3,p253 - p266,2014,10.1080/17482798.2013.869238,19-Dec-2013,https://doi.org/10.1080/17482798.2013.869238,1757.0,3.0
WILDFIRE ZONES ON A MOUNTAIN RIDGE,R WILLIAM FURMAN,Annals of the Association of American Geographers,68,1,p89 - p94,1978,10.1111/j.1467-8306.1978.tb01183.x,15-Mar-2010,https://doi.org/10.1111/j.1467-8306.1978.tb01183.x,7.0,4.0
Population dynamics of the Taimyr wild reindeer herd,"Leonid Kolpaschikov, Vladimir Mikhailov",International Journal of Environmental Studies,74,5,p862 - p883,2017,10.1080/00207233.2017.1284384,31-Aug-2017,https://doi.org/10.1080/00207233.2017.1284384,104.0,4.0
Modelling the spatial variability of wildfire susceptibility in Honduras using remote sensing and geographical information systems,"Kang-Tsung Chang, Chi-Farn Chen, Shou-Hao Chiang, Jorge Luis Santos, Miguel Conrado Valdez","Geomatics, Natural Hazards and Risk",8,2,p876 - p892,2017,10.1080/19475705.2016.1278404,25-Jan-2017,https://doi.org/10.1080/19475705.2016.1278404,4336.0,51.0
"The Wild Dog Estate, Australia: a case study in maximizing boutique winery profitability and business resilience","Paul Dean, Leon Juffermans, Gert Noordzy, Richard Whitfield",Journal of Teaching in Travel & Tourism,23,4,p494 - p511,2023,10.1080/15313220.2023.2190194,19-Mar-2023,https://doi.org/10.1080/15313220.2023.2190194,238.0,1.0
Application of End-Exhaled Breath Monitoring to Assess Carbon Monoxide Exposures of Wildland Firefighters at Prescribed Burns,"Isabelle Devaux, Kevin H Dunn, Luke P Naeher, Allison Stock",Inhalation Toxicology,21,1,p55 - p61,2009,10.1080/08958370802207300,01-Jan-2009,https://doi.org/10.1080/08958370802207300,251.0,12.0
"Crop Residue burning from high-resolution satellite imagery and PM2.5 dispersion: A case study of Mississippi County, Arkansas, USA","Ally Borkowski, Justin J Fain, Jessica L McCarty, Aaron M Shew, Maryam Zamanialaei",Sustainable Environment,9,1,,2023,10.1080/27658511.2023.2274646,31-Oct-2023,https://doi.org/10.1080/27658511.2023.2274646,3496.0,2.0
Burned area detection from a single satellite image using an adaptive thresholds algorithm,"Jilong Chen, Quan Duan, Ronggao Liu, Yang Liu, Xuexin Wei, Xin Zou",International Journal of Digital Earth,17,1,,2024,10.1080/17538947.2024.2376275,11-Jul-2024,https://doi.org/10.1080/17538947.2024.2376275,1788.0,7.0
Impact of logging operations on forest ecosystem in the Khantai mountain region and forest cover mapping,"Altangerel Balgan, Zaya Mart, Enkhjargal Natsagdorj, Bayanmunkh Norovsuren, Tsolmon Renchin, Batchuluun Tseveen",Forest Science and Technology,16,3,p123 - p133,2020,10.1080/21580103.2020.1796830,28-Jul-2020,https://doi.org/10.1080/21580103.2020.1796830,1989.0,1.0
The Effects of Introduced Wild Animals on New Zealand Forests,"Glenn H Stewart, Thomas T Veblen",Annals of the Association of American Geographers,72,3,p372 - p397,1982,10.1111/j.1467-8306.1982.tb01832.x,15-Mar-2010,https://doi.org/10.1111/j.1467-8306.1982.tb01832.x,127.0,51.0
The effects of different burning intensities on soil properties during recovery stage of forests in subtropical China,"F Liu, X Peng, G Wang, Y Zhan",Journal of Soil and Water Conservation,75,2,p166 - p176,2020,10.2489/jswc.75.2.166,01-Mar-2020,https://doi.org/10.2489/jswc.75.2.166,13.0,5.0
Where the Wild Things are Film Review,Bridgette Vidunas,Psychoanalytic Perspectives,7,2,p402 - p410,2010,10.1080/1551806x.2010.10473102,14-Feb-2012,https://doi.org/10.1080/1551806x.2010.10473102,87.0,0.0
Current status and predicted impact of climate change on forest production and biogeochemistry in the temperate oceanic European zone: review and prospects for Belgium as a case study,"Matteo Campioli, Gaston Demarée, Mathieu Jonard, Vincent Kint, Quentin Ponette, Caroline Vincke",Journal of Forest Research,17,1,p1 - p18,2012,10.1007/s10310-011-0255-8,15-Feb-2011,https://doi.org/10.1007/s10310-011-0255-8,265.0,40.0
Land use land cover (LULC) degradation intensity analysis of Guinea savannah and mosaic Forest savannah zones in Ghana,"Kueshi Sémanou Dahan, Rikiatu Husseini, Raymond Abudu Kasei",All Earth,35,1,p302 - p328,2023,10.1080/27669645.2023.2255443,04-Sep-2023,https://doi.org/10.1080/27669645.2023.2255443,2659.0,8.0
"Drought regulates the burned forest areas in Mexico: the case of 2011, a record year","Dario Cisneros-González, Marín Pompa-García, José Manuel Zúñiga-Vásquez",Geocarto International,34,5,p560 - p573,2019,10.1080/10106049.2017.1415986,19-Dec-2017,https://doi.org/10.1080/10106049.2017.1415986,195.0,10.0
Leveraging Google Earth Engine and Semi-Supervised Generative Adversarial Networks to Assess Initial Burn Severity in Forest,"Yaohong Qu, Guangyi Wang, Wenfang Xie, Youmin Zhang",Canadian Journal of Remote Sensing,48,3,p411 - p424,2022,10.1080/07038992.2022.2054405,04-Apr-2022,https://doi.org/10.1080/07038992.2022.2054405,303.0,2.0
Fires in GunaiKurnai Country: Landscape Fires and their Impacts on Aboriginal Cultural Heritage Places and Artefacts in Southeastern Australia,Simon Connor,Australian Archaeology,89,3,p284 - p286,2023,10.1080/03122417.2023.2273006,05-Dec-2023,https://doi.org/10.1080/03122417.2023.2273006,206.0,0.0
"Land Management Dynamics in Social Forestry Permit Using LandTrendr Algorithm: A Case Study in Tuar Tana Community Forest, East Nusa Tenggara Province, Indonesia","Ronggo Sadono, Heru Budi Santoso, Wahyu Wardhana",Forest Science and Technology,22,1,p36 - p49,2026,10.1080/21580103.2025.2548825,21-Aug-2025,https://doi.org/10.1080/21580103.2025.2548825,636.0,0.0
"Pregnancy, placentas and smoke exposure: multiple understandings of pregnant embodiment during the 2019-2020 Australian bushfires","Louisa Allen, Mary Lou Rasmussen, Celia Roberts, Rebecca Williamson",Health Sociology Review,34,3,p346 - p359,2025,10.1080/14461242.2025.2554072,05-Sep-2025,https://doi.org/10.1080/14461242.2025.2554072,618.0,0.0
"The Role and Effectiveness of Local Institutions in the Management of Forest Biodiversity in New Dabaga-Ulongambi Forest Reserve, Iringa Region-Tanzania","Richard A Giliba, Canisius J Kayombo, Yobu M Kiungo, Zacharia J Lupala, Patrick Mwendwa",Chinese Journal of Population Resources and Environment,10,1,p111 - p115,2012,10.1080/10042857.2012.10685068,20-May-2013,https://doi.org/10.1080/10042857.2012.10685068,165.0,4.0
"Patterns of land use, crop and forest cover change in the Ashanti region, Ghana","Kwasi O Agyeman, Owusu Amponsah, Theophilus Ansah, Michael O Asibey",Journal of Sustainable Forestry,39,1,p35 - p60,2020,10.1080/10549811.2019.1608453,30-Apr-2019,https://doi.org/10.1080/10549811.2019.1608453,1041.0,17.0
"Wild South American camelids (Mammalia, Artiodactyla): a review of their evolutionary and biogeographic history","Andrea G Castillo, Paulo Corti, Horacio Samaniego",Journal of Vertebrate Paleontology,,,,5187,10.1080/02724634.2026.2616326,17-Feb-2026,https://doi.org/10.1080/02724634.2026.2616326,95.0,0.0
A Review of Land Utilization in the U.S.: Agricultural and Forestry Land Use Competition,Bassam Hamdar,Journal of Sustainable Agriculture,17,1,p71 - p87,2000,10.1300/j064v17n01_07,24-Oct-2008,https://doi.org/10.1300/j064v17n01_07,65.0,0.0
Chapter 1. Indexing Resource Data for Forest Health Decisionmaking,"R Dwight Atkinson, Joe W Lewis, R Neil Sampson",Journal of Sustainable Forestry,11,1-2,p1 - p14,2000,10.1300/j091v11n01_01,17-Oct-2008,https://doi.org/10.1300/j091v11n01_01,24.0,4.0
"The woody vegetation of Central Otago, New Zealand","William G Lee, Geoffrey M Rogers, Susan Walker",New Zealand Journal of Botany,42,4,p589 - p612,2004,10.1080/0028825x.2004.9512914,17-Mar-2010,https://doi.org/10.1080/0028825x.2004.9512914,745.0,8.0
"Performance evaluation of commercially available non-regulatory instruments and sensors in smoke for PM, CO, CO2, NO2, and SO2","Maribel Colón, Jonathan D Krug, Matthew S Landis, Russell W Long, Jenny Perth, Shawn P Urbanski",Journal of the Air & Waste Management Association,,,p1 - p23,5187,10.1080/10962247.2026.2629562,12-Mar-2026,https://doi.org/10.1080/10962247.2026.2629562,151.0,0.0
"Assessing Trunk Dimensions of Complex, Large-Diameter Trees Using Mobile LiDAR: A Case Study of Giant Sequoia","John J Battles, Ashlyn L Olah, Robert A York",Journal of Sustainable Forestry,,,p1 - p24,5187,10.1080/10549811.2026.2646690,24-Mar-2026,https://doi.org/10.1080/10549811.2026.2646690,0.0,0.0
"Ponies Out of Place? Wild Animals, Wilderness and Environmental Governance",Adrian Peace,Anthropological Forum,19,1,p53 - p72,2009,10.1080/00664670802695616,10-Mar-2009,https://doi.org/10.1080/00664670802695616,624.0,10.0
STREAMFLOW CHARACTERISTICS OF FORESTED CATCHMENTS,A G McArthur,Australian Forestry,28,2,p106 - p118,1964,10.1080/00049158.1964.10675359,15-Apr-2013,https://doi.org/10.1080/00049158.1964.10675359,19.0,2.0
The impact of climate-related disasters on children's communication and wellbeing: Addressing Sustainable Development Goals,"Judith Crockett, Michael Curtin, Gene Hodgins, Nicole McGill, Tracey Parnell, Sarah Verdon",International Journal of Speech-Language Pathology,25,1,p20 - p26,2023,10.1080/17549507.2022.2156613,02-Feb-2023,https://doi.org/10.1080/17549507.2022.2156613,5477.0,12.0
A dendrochronological study of the exploitation and transformation of a boreal forest stand,"Hans Linderson, Lars Östlund",Scandinavian Journal of Forest Research,10,1-4,p56 - p64,1995,10.1080/02827589509382868,10-Dec-2008,https://doi.org/10.1080/02827589509382868,22.0,24.0
Use of GIS in Optimizing Timber Thinning Strategies in the Eastern Sierra Nevada∗,"Kathleen A Bishop, Paul A Knapp, Judith M Lancaster, Richard L Taylor",The Professional Geographer,45,3,p323 - p331,1993,10.1111/j.0033-0124.1993.00323.x,15-Mar-2010,https://doi.org/10.1111/j.0033-0124.1993.00323.x,18.0,0.0
Managing the Earth's Wild Lands,George Vrtis,Capitalism Nature Socialism,21,2,p126 - p128,2010,10.1080/10455751003676191,29-Jun-2010,https://doi.org/10.1080/10455751003676191,53.0,0.0
"Involvement of free-flying wild birds in the spread of the viruses of avian influenza, Newcastle disease and infectious bursal disease from poultry products to commercial poultry",P Gilchrist,World's Poultry Science Journal,61,2,p198 - p214,2005,10.1079/wps200451,23-Sep-2019,https://doi.org/10.1079/wps200451,68.0,22.0
"Forest Jihad: Assessing the Evidence for ""Popular Resistance Terrorism""","Daiana Marino, Sarah Marsden, Gilbert Ramsay",Studies in Conflict & Terrorism,37,1,p1 - p17,2014,10.1080/1057610x.2014.853604,20-Dec-2013,https://doi.org/10.1080/1057610x.2014.853604,1013.0,4.0
Does Wilderness Matter in the Anthropocene? Resolving a Fundamental Dilemma About the Role of Wilderness in 21st Century Conservation,"Patrick Kelly, Peter Landres","Ethics, Policy & Environment",26,3,p422 - p437,2023,10.1080/21550085.2022.2133942,18-Oct-2022,https://doi.org/10.1080/21550085.2022.2133942,500.0,5.0
"Co-designing for First Nations leadership in land management: listening to stories, designing for experience, and advocating for change","Jacqueline Gothe, Sarah Jane Jones, Jessica Wegener, Barry Williams",CoDesign,,,p1 - p21,5187,10.1080/15710882.2025.2505925,21-May-2025,https://doi.org/10.1080/15710882.2025.2505925,1780.0,0.0
"Detection of annual burned forest area using change metrics constructed from MODIS data in Manitoba, Canada","Jian Chen, Zhenbo Liu, Shijie Sheng",International Journal of Remote Sensing,36,15,p3913 - p3931,2015,10.1080/01431161.2015.1055605,28-Jul-2015,https://doi.org/10.1080/01431161.2015.1055605,265.0,3.0
"A ""wild free life"": Susan Allison in response to land and place on the frontier of British Columbia",Maggie Pickering,Women's Writing,8,3,p403 - p418,2001,10.1080/09699080100200148,19-Dec-2006,https://doi.org/10.1080/09699080100200148,50.0,0.0
Explaining Return Times for Wildfires,"Alan E Gelfand, Joao V D Monteiro",Journal of Statistical Theory and Practice,8,3,p534 - p545,2014,10.1080/15598608.2013.821047,05-May-2014,https://doi.org/10.1080/15598608.2013.821047,54.0,4.0
