;#pray4victims: consistencies in response to disaster on twitter
;reporting the community beat: practices for moderating online discussion at a news website
;representative and back-in-time sampling from real-world hypergraphs
;representing 3-dimensional fuels for physics-based fire behavior models: a general framework and case study in a type-converted post-fire shrubfield
;requirements for space-based observations in fire management: a report by the wildland fire hazard team, committee on earth observation satellites (ceos) disaster management support group (dmsg)
;rescuecastr: exploring photos and live streaming to support contextual awareness in the wilderness search and rescue command post
;research in education
;research on auto extraction of interested region in fire image compression
;research on forest and grassland fire detection algorithm based on himawari-8 geostationary satellite
;research on forest fire detection based on wireless sensor network
;research on multi-factor forest fire prediction model using machine learning method in china
;research on remote sensing recognition of forest fire smoke based on machine learning
;research trends in wildland fire prediction amidst climate change: a comprehensive bibliometric analysis
;resilience of a tropical montane pine forest to fire and severe droughts
;resilient machine learning: advancement, barriers, and opportunities in the nuclear industry
;resilient power systems against wildfire risks: towards a human-centric and secure future
;resonance+: operationalizing protective action decision model for finding information useful for public information officers
;resource location and relocation models with rolling horizon forecasting for wildland fire planning
;respiratory injuries among california career firefighters, 2000-2019
;responding to bushfire risk: the need for transformative adaptation
;response of permafrost active layer thickenss and seasonal deformation to wildfire in pan-arctic
;response of pollinator taxa to fire is consistent with historic fire regimes in the sierra nevada and mediated through floral richness†
;response of vulnerable karst forest ecosystems under different fire severities in the northern dinaric karst mountains (slovenia)
;response to on the reproducibility of quantitative susceptibility mapping and its potential as a clinical biomarker: a comment on cogswell et al. 2021
;restoration relevance of recent national fire plan treatments in forests of the western united states
;restoring fire regimes through rewilding
;restoring frequent fire to dry conifer forests delays the decline of subalpine forests in the southwest united states under projected climate
;restoring resilient mediterranean landscapes: long-term benefits of integrated post-fire management for ecosystem multifunctionality
;rethinking fire resilience in the built environment: a comparative review of post-earthquake and wui fires
;rethinking nature of stem: theoretical insights and the development of epistemik-fire as an assessment tool
;rethinking the agricultural use of fire and its influence on the occurrence of wildfire in high andean communities of cusco, peru
;retracted article: research on fire accident prediction and risk assessment algorithm based on data mining and machine learning
;reverse-mode differentiation in arbitrary tensor network format: with application to supervised learning
;review and perspectives of digital twin systems for wildland fire management
;review article: social media for managing disasters triggered by natural hazards: a critical review of data collection strategies and actionable insights
;review of bioterrorism: mathematical modeling applications in homeland security by h. t. banks and c. castillo-chavez
;review of fuel treatment effects on fuels, fire behavior and ecological resilience in sagebrush (<i>artemisia</i> spp.) ecosystems in the western u.s
;review of geoinformatics-based forest fire management tools for integrated fire analysis
;review of knowledge transfer program based on mobile phone (keitai)s technology prediction and its psychological impact on users
;review of landslide susceptibility assessment based on knowledge mapping
;review of machine learning and deep learning techniques for flood forecasting
;review of methods for automatic speaker verification
;review of modern forest fire detection techniques: innovations in image processing and deep learning
;review of research on human behavior in large outdoor fires
;review of researches on regional landslide susceptibility mapping model
;review of the health effects of wildland fire smoke on wildland firefighters and the public
;review of users needs in operational fire danger estimation: the oklahoma example
;review of vortices in wildland fire
;review of wildfire management techniques-part i: causes, prevention, detection, suppression, and data analytics
;review on applications of lidar mapping technology to geosciences
;review on landslide susceptibility mapping using support vector machines
;review on sustainable forestry with artificial intelligence
;review on the application of machine learning methods in landslide susceptibility mapping
;review on the covid-19 pandemic prevention and control system based on ai
;review study on recent developments in fire sensing methods
;review: refuges for fauna in fire-prone landscapes: their ecological function and importance
;reviewing flood susceptibility mapping utilizing machine learning: insights and prospects for future research
;revolting from abroad: the formation of a lebanese transnational public
;reward maximization for disaster zone monitoring with heterogeneous uavs
;rhizomorph: the coordinated function of shoots and roots
;riau forest fire prediction using supervised machine learning
;risk analysis vii: simulation and hazard mitigation-&, brownfields v: prevention, assessment, rehabilitation and development of brownfield sites
;risk factors associated with day-30 mortality in patients over 60 years old admitted in icu for severe covid-19: the senior-covid-rea multicentre survey protocol
;risk perception and behavioral context: u.s. forest service fire management professionals
;risk perceptions and mitigation behaviors of residents following a near-miss wildfire
;riverside landslide susceptibility overview: leveraging artificial neural networks and machine learning in accordance with the united nations (un) sustainable development goals
;robust fake news detection over time and attack
;robust networking: dynamic topology evolution learning for internet of things
;robust prediction of wildfire spread in australia
;robust sensor-orientation-independent feature selection for animal activity recognition on collar tags
;robust shallow water models
;robust wildfire forecasting under partial observability: from reconstruction to prediction
;robust wireless rechargeable sensor networks
;roc: resilient online coverage for surveillance applications
;rock fall susceptibility mapping using artificial neural network, frequency ratio, and logistic regression: a case study in central iran, taft county
;rocknet: distributed learning on ultra-low-power devices
;role of buoyant flame dynamics in wildfire spread
;role of machine learning algorithms in forest fire management: a literature review
;role of machine learning and big data in healthcare for the prediction of epidemic diseases: a survey
;roles of fire in the plant communities of the eastern edwards plateau of texas
;rule based fuzzy computing approach on self-supervised sentiment polarity classification with word sense disambiguation in machine translation for hindi language
;rumor blocking through online link deletion on social networks
;rumor gauge: predicting the veracity of rumors on twitter
;rural islandness as a lens for (rural) hci
;rural uncommoning: women, community networks and the enclosure of life
;saferhome: interactive physical and digital smart home dashboards for communicating privacy assessments to owners and bystanders
;sake: estimating katz centrality based on sampling for large-scale social networks
;salient value similarity, social trust and attitudes toward wildland fire management strategies
;salvage logging after landslide changes habitat use of medium-sized mammals
;salvage logging reduces wild bee diversity, but not abundance, in severely burned mixed-conifer forest
;sanskrit parsing following indian theories of verbal cognition
;sarcasm detection in arabic short text: a novel approach leveraging pre-trained language models and addressing the data imbalance problem
;satellite based deep learning approaches for detecting environmental disasters across kazakhstan
;satellite image search in agoraeo
;satellite image segmentation for forest fire risk detection using gaussian mixture models
;satellite-based analysis of forest fires in the bolivian chiquitania and amazon region: case 2019
;satellite-based differentiation of anthropogenic and forest fire co2 emission regions
;satellite-based ensemble intelligent approach for predicting forest fire: a case of the hyrcanian forest in iran
;satellite-based fraction of available water reveals soil moisture deficits preceding major wildfires
;savanna fire regimes assessment with modis fire data: their relationship to land cover and plant species distribution in western burkina faso (west africa)
;scalable and efficient hypothesis testing with random forests
;scalable and robust snapshot isolation for high-performance storage engines
;scalable cloning on large-scale gpu platforms with application to time-stepped simulations on grids
;scalable game design: a strategy to bring systemic computer science education to schools through game design and simulation creation
;scalable lighting-fast temporal indexing: scalable lighting-fast temporal indexing
;scalable pythagorean mean-based incident detection in smart transportation systems
;scalable spatio-temporal top-k interaction queries on dynamic communities
;scalable sub-meter mapping of woody vegetation and structures across californias heterogeneous landscape using deep learning
;scaling high-quality pairwise link-based similarity retrieval on billion-edge graphs
;scheduling and routing with degradation-triggered job arrivals: an application to forest firefighting with an unmanned aerial vehicle fleet
;scheduling jobs to contain a natural disaster: a model and complexity
;scheduling language chronology: past, present, and future
;scheduling survivability-heterogeneous sensor networks for critical location surveillance
;scintilla: simulating combustible vegetation for wildfires
;searching for affirmation: how partisan audiences on google search induce an abortion-related filter bubble effect
;seasonal differences in the spatial patterns of wildfire drivers and susceptibility in the southwest mountains of china
;seasonal forest fire risk and key drivers in yunnan province: a machine learning approach
;security and privacy in iot using machine learning and blockchain: threats and countermeasures
;security challenges, mitigation strategies, and future trends in wireless sensor networks: a review
;security threats, countermeasures, and challenges of digital supply chains
;see no evil, hear no evil: audio-visual-textual cyberbullying detection
;selection of additional trainig data for improving accuracy of forest type classification using hyperspectral data
;self-calibration and collaborative localization for uwb positioning systems: a survey and future research directions
;self-organized critical forest-fire model
;self-organizing routing protocol to achieve qos in wireless sensor network forest fire monitoring
;self-organizing synchronization with inhibitory-coupled oscillators: convergence and robustness
;self-similarity in social network dynamics
;self-stabilizing robot formations over unreliable networks
;semantic drift in multilingual representations
;semantic embedding for regions of interest
;semantic optimization of conjunctive queries
;semantic segmentation of burned areas in sentinel-2 satellite images using deep learning models
;semantics-based analysis of content security policy deployment
;semg-based upper limb movement classifier: current scenario and upcoming challenges
;sensing the sensor: estimating camera properties with minimal information
;sensitivity of burned area and fire radiative power predictions to containment efforts, fuel density, and fuel moisture using wrf-fire
;sensitivity simulations of the 30 march 2020 xichang wildfire in southwest china based on the wrf-fire model
;sensitivity to the representation of wind for wildfire rate of spread: case studies with the community fire behavior model
;sentiment analysis of code-mixed telugu-english data leveraging syllable and word embeddings
;sentiment and social signals in the climate crisis: a survey on analyzing social media responses to extreme weather events
;seq2turk: turkish spelling error correction using context-dependent sequence-to-sequence model
;sequential decision algorithms for measurement-based impromptu deployment of a wireless relay network along a line
;service-learning to improve training, knowledge transfer, and awareness in forest fire management
;severe fire danger index: a forecastable metric to inform firefighter and community wildfire risk management
;severe fire has impacted populations of the california spotted owl more than fuels management or drought-related tree mortality
;severe fire weather and intensive forest management increase fire severity in a multi-ownership landscape
;sgrow: explaining the scale-invariant strength assortativity of streaming butterflies
;shap-driven explainable artificial intelligence framework for wildfire susceptibility mapping using modis active fire pixels: an in-depth interpretation of contributing factors in izmir, turkiye
;shapley-based interpretation of deep learning models for wildfire spread rate prediction
;sharing economy in russia: a possible new source of political participation and democratization?
;shifting drivers of holocene fire regimes in uzbekistan: from natural factors to anthropogenic impact
;short-term fire front spread prediction using inverse modelling and airborne infrared images
;short-term responses of birds to prescribed fire in fire-suppressed forests of california
;should we leave now? behavioral factors in evacuation under wildfire threat
;should we use the sample? analyzing datasets sampled from twitters stream api
;sickle-cell disorders: limits of descriptive epidemiology
;sign language recognition using sub-units
;signals of transition in support systems: a study of the use of social media analytics in crisis management
;silver tape: inkjet-printed circuits peeled-and-transferred on versatile substrates
;silviculture and fire effects on understorey flowering in jarrah forest
;simulating the potential for invasive grass expansion to alter wildfire behavior in southern california with wrf-fire
;simulating wildfire spread based on continuous time series remote sensing images and cellular automata
;simulation and visualization of forest fire growth in an integrated 3d virtual geographical environment-a preliminary study
;simulation of short-term post-fire vegetation recovery by integration of landfire data products, dnbr data and landis modeling
;single network relational transductive learning
;single-photon 3d imaging with deep sensor fusion
;situational influences of acceptable wildland fire management actions
;six feet apart: online payments during the covid-19 pandemic
;sleep-mode voltage scaling: enabling sram data retention at ultra-low power in embedded microcontrollers
;sliding window-based approximate triangle counting with bounded memory usage
;small business innovation research program
;small mammals and forest fuel reduction: national-scale responses to fire and fire surrogates
;small world network model validation. case study of suartone historical fire in corsica
;smallest pareto confidence regions and applications
;smart computing and sensing technologies for animal welfare: a systematic review
;smart forest guardians: advances in fire detection using machine learning
;smart wireless sensor networks with virtual sensors for forest fire evolution prediction using machine learning
;smartening up the student learning experience with ubiquitous media
;smartparcels: constructing smart communities through human-in-the-loop urban iot planning
;smoke and the eyes: a review of the harmful effects of wildfire smoke and air pollution on the ocular surface
;smokey the tapir: traditional fire knowledge and fire prevention campaigns in lowland bolivia
;smokingopp: detecting the smoking opportunity context using mobile sensors
;snap: a general-purpose network analysis and graph-mining library
;snoopy: sniffing your smartwatch passwords via deep sequence learning
;social amplification of wildfire risk: the role of social interactions and information sources
;social and historical dimensions of wildfire research and the consideration given to practical knowledge: a systematic review
;social insects and beyond: the physics of soft, dense invertebrate aggregations
;social media data mining of human behaviour during bushfire evacuation
;social network analysis and mining for business applications
;social norm vulnerability and its consequences for privacy and safety in an online community
;social relationship analysis using state-of-the-art embeddings
;social science research related to wildfire management: an overview of recent findings and future research needs
;social semantic query expansion
;socially enhanced situation awareness from microblogs using artificial intelligence: a survey
;software pipelining
;software-based simulations of wildfire spread and wind-fire interaction
;soil factors influencing wildfire behavior and severity: a review
;soil heating in fire (shefire): a model and measurement method for estimating soil heating and effects during wildland fires
;soil moisture is a stronger predictor of forest fire spread potential than weather in the u.s. northern rocky mountains
;soil moisture retrieval on sloped terrains using airborne sar data for the nisar mission
;soil organic carbon fractionation assessment in areas with high fire activity using diffuse spectroscopy and tree-based machine learning algorithms
;soil redistribution and seed availability after fire events in mixed <i>austrocedrus chilensis</i> forests in northern patagonia (argentina)
;soil resilience assessment using soil profile descriptions and analytic hierarchy process in mediterranean mountains considering diverse fire occurrences
;soil-fire feedbacks drive the flammability of <i>miscanthus floridulus</i> in subtropical hubei, china
;sok: acoustic side channels
;solar intensity dispersing (sid) concept for cubesat spectral clarreo-like radiance measurements
;solid-fluid interaction on particle flow maps
;sound event detection using multiple optimized kernels
;soundscape of an archaeological site recreated with audio augmented reality
;space to policy: scalable brick kiln detection and automatic compliance monitoring with geospatial data
;space vision: developing a game for vision screening and home-based monitoring
;space-based forest fire risk assessment and mapping: a case study of wayanad district, kerala
;space-efficient parameterized algorithms on graphs of low shrubdepth
;spain on fire: a novel wildfire risk assessment model based on image satellite processing and atmospheric information
;spam mobile apps: characteristics, detection, and in the wild analysis
;sparsity in deep learning: pruning and growth for efficient inference and training in neural networks
;spatial analysis and machine learning prediction of forest fire susceptibility: a comprehensive approach for effective management and mitigation
;spatial and temporal expansion of global wildland fire activity in response to climate change
;spatial bayesian belief networks: a participatory approach for mapping environmental vulnerability at the itatiaia national park, brazil
;spatial data in information system for operational prediction of wildfire behaviour and their cartographic visualization
;spatial infrastructures for the fire-resilient forest: designing for the big thin
;spatial modeling of gully erosion using linear and quadratic discriminant analyses in gis and r
;spatial modelling of wildland fire danger for risk analysis and conflict resolution in malaysia: linking fire danger rating systems (fdrs) with wildfire threat rating systems (wtrs)
;spatial overlap of wildfire and biodiversity in california highlights gap in non-conifer fire research and management
;spatial partition-based particle filtering for data assimilation in wildfire spread simulation
;spatial pattern analysis and prediction of forest fire using new machine learning approach of multivariate adaptive regression splines and differential flower pollination optimization: a case study
;spatial patterns of fire occurrence in the central appalachian mountains and implications for wildland fire management
;spatial prediction of landslide susceptibility using an adaptive neuro-fuzzy inference system combined with frequency ratio, generalized additive model, and support vector machine techniques
;spatial prediction of shallow landslide: application of novel rotational forest-based reduced error pruning tree
;spatial prediction of wildfire susceptibility using field survey gps data and machine learning approaches
;spatial prediction of wildfire susceptibility using hybrid machine learning models based on support vector regression in sydney, australia
;spatial uncertainty quantification in wildfire forecasting for climate-resilient emergency planning
;spatial variability in arctic-boreal fire regimes influenced by environmental and human factors
;spatial-temporal data mining for ocean science: data, methodologies and opportunities
;spatio-temporal analysis of forest fire events in the margalla hills, islamabad, pakistan using socio-economic and environmental variable data with machine learning methods
;spatio-temporal assessment of fire severity in a protected and mountainous ecosystem
;spatio-temporal characterization of landscape fire in relation to anthropogenic activity and climatic variability over the western himalaya, india
;spatio-temporal data mining: a survey of problems and methods
;spatio-temporal interactions between wild and free-ranging domestic ungulates in the central pyrenees
;spatio-temporal patterns and drivers of fire spread and severity: a case study of an extreme wildfire in chinas boreal forests
;spatiotemporal impacts of forest fires on mountain vegetation: a case study from langtang national park, nepal himalaya
;spatiotemporal monitoring of post-fire soil erosion rates using earth observation (eo) data and cloud computing
;spatiotemporal patterns of unburned areas within fire perimeters in the northwestern united states from 1984 to 2014
;spatiotemporal prediction of ground surface deformation using tpe-optimized deep learning
;specifying concurrent programs in separation logic: morphisms and simulations
;specsims: a scalable speculative tree-based simulation cloning framework for finite memory machines
;speculative design as a collaborative practice: ameliorating the consequences of illiteracy through digital touch
;spiketouch: optimizing spike neural networks for tactile perception
;spinifex, fire, and fate
;spinning the conductors of an indigenous tradition: toward a continuity of traditional andean weaving with new electronic technologies
;spirits in the material world: older adults personal curation of memory artifacts
;spoken dialogue technology: enabling the conversational user interface
;spot fire ignition of natural fuel beds by hot metal particles, embers, and sparks
;spotted owls and forest fire: a systematic review and meta-analysis of the evidence
;spotting flares: the vital signs of the viral spread of tweets made during communal incidents
;stable model semantics for guarded existential rules and description logics: decidability and complexity
;stable regression: on the power of optimization over randomization in training regression problems
;stard-net: spatiotemporal attention for robust detection of tiny airborne objects from moving drones
;state of knowledge in the field of regenerative hardfacing methods in the context of the circular economy
;static analysis of active xml systems
;static scheduling algorithms for allocating directed task graphs to multiprocessors
;statistical modeling for the prediction of infectious disease dissemination with special reference to covid-19 spread
;statistical models for the location of lightning-caused wildfire ignitions
;statistically scrutinizing impact of climate variability on forest fire incidents in turkey
;statistically-robust clustering techniques for mapping spatial hotspots: a survey
;statistische und probabilistische methoden der modellwahl
;stochastic modeling of wildfire spread using deep recurrent neural networks: a data-driven computational approach for analyzing natural hazards
;strategic fire zones are essential to wildfire risk reduction in the western united states
;strategic wildfire response decision support and the risk management assistance program
;strategies for preventing invasive plant outbreaks after prescribed fire in ponderosa pine forest
;streamers hell-investigating audience influence in live-streams beyond the game
;streaming social event detection and evolution discovery in heterogeneous information networks
;stuck in isabels garden: anthropomorphic metaphors and the oversimplification of digital privacy
;studies on the forest dieback phenomenon in a semi-arid region using remotely sensed data
;study of routing protocols used in sensor networks forest fire detection
