;#pray4victims: consistencies in response to disaster on twitter
;data work and decision making in emergency medical services: a distributed cognition perspective
;data-driven analytical models of covid-2019 for epidemic prediction, clinical diagnosis, policy effectiveness and contact tracing: a survey
;data-driven authoring of large-scale ecosystems
;data-driven simulations of wildfire spread at regional scales
;data-driven spatio-temporal analysis of wildfire risk to power systems operation
;data-driven techniques in disaster information management
;datastorm: coupled, continuous simulations for complex urban environments
;date of publication xxxx 00, 0000, date of current version xxxx 00, 0000
;davos: a system for interactive data-driven decision making
;deadwood: including disturbance and decay in the depiction of digital nature
;death rides the forest: perceptions of fire, land use, and ecological restoration of western forests
;decadal (2012-2023) account of spatio-temporal variability in satellite-detected biomass fires on indian landmass and their fire radiative power
;deciphering the impact of uncertainty on the accuracy of large wildfire spread simulations
;decision support system for forest fire management using ontology with big data and llms
;decoding fake news and hate speech: a survey of explainable ai techniques
;decoding vegetations role in landslide susceptibility mapping: an integrated review of techniques and future directions
;decolonizing wildfire risk management: indigenous responses to fire criminalization policies and increasingly flammable forest landscapes in lomerio, bolivia
;deep learning and transformer approaches for uav-based wildfire detection and segmentation
;deep learning applications for covid-19
;deep learning approach for uav-based wildfire detection and segmentation
;deep learning approaches for detecting covid-19 from chest x-ray images: a survey
;deep learning approaches for wildland fires using satellite remote sensing data: detection, mapping, and prediction
;deep learning based cyclone intensity estimation using insat-3d ir imagery
;deep learning for biometrics: a survey
;deep learning for collective anomaly detection
;deep learning for exploring landslides with remote sensing and geo-environmental data: frameworks, progress, challenges, and opportunities
;deep learning for human mobility: a survey on data and models
;deep learning for wildfire risk prediction: integrating remote sensing and environmental data
;deep learning methods for daily wildfire danger forecasting
;deep learning methods for flood mapping: a review of existing applications and future research directions
;deep learning models for forest fire prediction: insights into feature selection for climate-resilient forestry
;deep learning techniques for covid-19 diagnosis and prognosis based on radiological imaging
;deep learning-based fire and smoke detection system
;deep scars of fire: a conundrum of shrinking forests, biological invasions, and dryness leading to lower water provision and security
;deep-learning-based dynamic early warning and spread prediction model for wildfires along transmission lines
;defining extreme wildfire events: difficulties, challenges, and impacts
;defining scents: a systematic literature review of olfactory-based computing systems
;defining the importance of mental preparedness for risk communication and residents well-prepared for wildfire
;delft university of technology modeling wildfire spread in wildland-industrial interfaces using dynamic bayesian network
;delineation of wildfire impacts on soil geochemistry and post-fire soil quality assessment: the case of the august 2024 wildfire in ne attica, greece
;demographic representation and collective storytelling in the me too twitter hashtag activism movement
;demography and socioeconomic vulnerability influence fire occurrence in bariloche (argentina)
;demystifying graph sparsification algorithms in graph properties preservation
;dengue epidemics prediction: a survey of the state-of-the-art based on data science processes
;density-based machine learning scheme for outlier detection in smart forest fire monitoring sensor cloud
;dependency-induced waste in continuous integration: an empirical study of unused dependencies in the npm ecosystem
;deploying wildland fire suppression resources with a scenario-based standard response model
;depression at work: exploring depression in major us companies from online reviews
;derivation of a bayesian fire spread model using large-scale wildfire observations
;dermatologic manifestations of extreme heat, wildfires, and flooding
;desaa national forest reserve susceptibility to fire under climate change
;desert/forest fire detection using machine/deep learning techniques
;desiderata for representation learning: a causal perspective
;design and evaluation of metaphor processing systems
;design and fabrication of multifunctional e-textiles by upcycling waste cotton fabrics through carbonization
;design experiences in minimalistic flying sensor node platform through sensorfly
;design for rituals of letting go: an embodiment perspective on disposal practices informed by grief therapy
;design of self-sustainable wireless sensor networks with energy harvesting and wireless charging
;designing a dual-level facial expression evaluation system for performers using geometric features and petri nets
;designing for bodily interplay in social exertion games
;designing interactive multiswimmer exergames: a case study
;designing sharing economy platforms through a solidarity hci lens
;deslib: a dynamic ensemble selection library in python
;detecting and measuring aggressive location harvesting in mobile apps via data-flow path embedding
;detecting hard-coded credentials in software repositories via llms
;detecting malicious data injections in wireless sensor networks: a survey
;detecting patterns of post-fire pine regeneration in a madrean sky island with field surveys and remote sensing
;detecting smart ponzi schemes on blockchain using machine learning: a comprehensive survey
;detection and resolution of rumours in social media: a survey
;detection of disaster-affected cultural heritage sites from social media images using deep learning techniques
;detection of fake hotel reviews using anfis and natural language processing techniques
;detection of forest fires based on aerial survey data using neural network technologies
;detection of offensive language and its severity for low resource language
;detection of peat fire risk area based on impedance model and dinsar approaches using alos-2 palsar-2 data
;determinants of west nile virus (wnv) incidence in select regions of canada: an examination of climate and ecological drivers in british columbia and saskatchewan
;determination of forest fire risk with fuzzy analytic hierarchy process and its mapping with the application of gis: the case of turkey/cakırlar
;determination of social perception of the role of forest fire break roads and fire lanes in fire prevention
;determining resilience gains from anomaly detection for event integrity in wireless sensor networks
;developing a climate-tailored integrated long-term care framework: strengthening policy and practice response
;developing evidence briefs for landscape fire management
;developing new coastal forest restoration products based on landsat, aster, and modis data
;developing novel machine-learning-based fire weather indices
;developing the us wildland fire decision support system
;developing threshold classification model of burned area severity using sentinel-2 medium resolution satellite images
;development and implementation of a landslide susceptibility zoning system for the uk rail network
;development and implementation of a landslide susceptibility zoning system for the uk rail network developpement et mise en œuvre dun systeme de zonage de susceptibilite aux glissements de
;development and usability evaluation of transitional cross-reality interfaces
;development of a dataset and a deep learning baseline named entity recognizer for three low resource languages: bhojpuri, maithili, and magahi
;development of a forest fire diagnostic model based on machine learning techniques
;development of a spatial decision support system (sdss) for the active forest-urban fires management through location planning of mobile fire units
;development of learning outcomes using classroom project constraint systems
;dgmf: a unified dynamic mapping framework for graph neural networks
;diagnosing strep throat in the adult patient: do clinical criteria really suffice?
;diagnostic accuracy of an app-guided, self-administered test for influenza among individuals presenting to general practice with influenza-like illness: study protocol
;diagnostic performance of t2* gradient echo, susceptibility-weighted imaging, and quantitative susceptibility mapping for patients with multiple system atrophy-parkinsonian type: a systematic review
;differences in canopy cover estimations from als data and their effect on fire prediction
;differentiable hybrid traffic simulation
;differential impact of fire on tree diversity, composition, structure and carbon stock in tropical savanna
;differentiating effects of salvage logging and recovery patterns on post-fire boreal forests in northeast china using a modified forest disturbance index
;digital 3d reconstruction of ancient chinese great wild goose pagoda by tls point cloud hierarchical registration
;digital accessibility education in context: expert perspectives on building capacity in academia and the workplace
;digital elevation models of rockfalls and landslides: a review and meta-analysis
;digital olfaction system driven by terahertz sensing
;digital soil mapping for fire prediction and management in rangelands
;digital strategies in wildfire management: social media analytics and web 3.0 integration
;digital technology at the edge of capitalism: experiences from the brazilian amazon rainforest
;digital wildfires: propagation, verification, regulation, and responsible innovation
;dilemmas in mutual aid: lessons for crisis informatics from an emergent community response to the pandemic
;direct and indirect effects of fire on microbial communities in a pyrodiverse dry-sclerophyll forest
;disaster assessment algorithm after forest fire based on gis
;disaster damage as a driver of climate resilience policy support
;disaster management in the digital era: a survey on the integration of ai and uavs in disaster response and recovery
;disaster preparedness training relevance for organizational response effectiveness: a healthcare executive perspective
;discourse-oriented anaphora resolution in natural language understanding: a review
;discrete wildfire simulation case study
;discrimination of peat swamp forest types with hyperspectral data
;displacement after the camp fire: where are the most vulnerable?
;dissecting cloud gaming performance with decaf
;dissecting my data body: how to know thyself as a virtual reality in the digital age
;dissimilarity measures and divisive clustering for symbolic multimodal-valued data
;distinct diversity trajectories of boreal wood-inhabiting fungi following fire versus clear-cutting
;distributed constraint optimization problems and applications: a survey
;distributed detection of sequential anomalies in univariate time series
;distributed intelligent mems: a survey and a real-time programming framework
;distributed low-latency data aggregation scheduling in wireless sensor networks
;distributed node deployment algorithms in mobile wireless sensor networks: survey and challenges
;distributed spacecraft with heuristic intelligence to monitor wildfire spread for responsive control
;distribution mapping of major invasive plant species of india and their role in ecosystem alteration: a systematic review
;distribution of corbicula fluminea (muller, 1774) in the invaded range: a geographic approach with notes on species traits variability
;distribution of threatened crayfishes and spread of an invasive crayfish in the upper saint francis river drainage, missouri
;distribution patterns of fire regime in the pendjari biosphere reserve, west africa
;disturbance refugia within mosaics of forest fire, drought, and insect outbreaks
;diverse historical fire disturbance and successional dynamics in douglas-fir forests of the western oregon cascades, usa
;do any differences between perceived and professional wildfire risk influence the amount homeowners would pay for public and private fuel reduction?
;do architects and designers think about interactivity differently?
;do bark beetle outbreaks increase wildfire risks in the central u.s. rocky mountains? implications from recent research
;does forest thinning reduce fire severity in australian eucalypt forests?
;dog owners are concerned about ambient air quality and require veterinary guidance
;dont break my flow: effects of switching latency in shooting video games
;dont miss weak packets: boosting lora reception with antenna diversities
;douleur: creating pain sensation with chemical stimulant to enhance user experience in virtual reality
;douyin as a memorial gathering for coco: algorithmic experiences of online collective mourning
;dr-occluder: generating occluders using differentiable rendering
;drama: unifying data retrieval and analysis for open-domain analytic queries
;drivers of extreme wildfire years in the 1965-2019 fire regime of the tłıcho first nation territory, canada
;drivers of forest fires under fire management policies: a comparison of machine learning models based on multi-temporal modis fire data
;drivers of wildfire suppression costs: literature review and annotated bibliography
;driving wildfire spread prediction by multi-source real-time observations
;drought before fire increases tree mortality after fire
;drowzee: metamorphic testing for fact-conflicting hallucination detection in large language models
;dry forests and wildland fires of the inland northwest usa: contrasting the landscape ecology of the pre-settlement and modern eras
;dtrl: decision tree-based multi-objective reinforcement learning for runtime task scheduling in domain-specific system-on-chips
;dual-stage wildfire risk analysis in south korea: susceptibility mapping from a decade of firms data and 2025 burn area detection with multi-sensor classification
;dynamic association of slope movements in the uttarakhand himalaya: a critical review on the landslide susceptibility assessment
;dynamic bayesian beta models
;dynamic cluster head selection in wsn
;dynamic correction of forest fire spread prediction using observation error covariance matrix estimation technique based on flc-gru
;dynamic fire regimes and forest conditions across three centuries in a shortleaf pine-oak forest in the ouachita mountains, arkansas, usa
;dynamic fire-atmosphere interaction in the 2020 montana bridger foothills wildfire as revealed by wrf-sfire simulations
;dynamic profiling and fuzzy-logic-based optimization of sensor network platforms
;dynamic uav path planning under wildfire scenarios using ppo algorithm
;dynamics of change in the practice of female genital cutting in senegambia: testing predictions of social convention theory
;dynamics of fire, precipitation, vegetation and ndvi in dry forest environments in nw argentina. contributions to environmental archaeology
;early adaptive evaluation scheme for data-driven calibration in forest fire spread prediction
;early detection of bark beetle attack using remote sensing and machine learning: a review
;early detection of health changes in the elderly using in-home multi-sensor data streams
;early forest fire detection using machine learning algorithms
;early post-fire vegetation recovery and its biotic and abiotic drivers of phylogenetic characteristic in a korean forest
;early prediction of forest fire events integrating multi-sensor datasets and machine learning techniques
;early recognition of 3d human actions
;early stage forest fire detection from himawari-8 ahi images using a modified mod14 algorithm combined with machine learning
;earth observation based characterization of environmental conditions for forest fire risk in western himalayan ecosystems using machine learning approach
;earth, wind, and fire: wildfire risk perceptions in a hurricane-prone environment
;earthquake maps for developing areas in the san francisco bay area
;ecmas+: efficient circuit mapping and scheduling for surface code encoded circuit on quantum cloud platform
;eco-anxiety and mental health: correlates of climate change distress
;eco-cultural monitoring reveals low impact of a dharug <i>dhiyina</i>&#xa0-women-led <i>guwiyang</i> (fire) in an urban national park, australia
;ecoclimates: climate-response modeling of vegetation
;ecological implications of forest fire in seasonally dry tropical forests: a systematic review
;ecological implications of the direct effects of fire on neotropical vertebrates
;economic analysis of wildfire impacts to water quality: a review
;economic benefits of reducing fire-related sediment in southwestern fire-prone ecosystems
;economic efficiency of fuel treatments in western us forests: a methodological framework
;economic incentives for reducing wildfire risk: taking stock of an emerging field
;economics and finance in emerging markets
;econophysics and sociophysics: trends and perspectives
;edge effects in fire-prone landscapes: ecological importance and implications for fauna
;edge intelligence: concepts, architectures, applications, and future directions
;edge vision for wildfires: a comprehensive investigation
;effect of fuel spatial resolution on predictive wildfire models
;effect of prescribed burning on wildfire severity: a landscape-scale case study from the 2003 fires in victoria
;effectiveness and cost-effectiveness of ecosystem-based disaster risk reduction interventions in low-and middle-income countries: a rapid systematic review: a systematic review
;effectiveness of firebreaks: a review
;effects of a large wildfire on vegetation structure in a variable fire mosaic
;effects of explanations in ai-assisted decision making: principles and comparisons
;effects of fire and fire-induced changes in soil properties on post-burn soil respiration
;effects of fire disturbance on bird communities and species of mountain serrano forest in central argentina
;effects of forest management on california spotted owls: implications for reducing wildfire risk in fire-prone forests
;effects of large herbivores on fire regimes and wildfire mitigation
;effects of large mammalian herbivores and lagomorphs on post-fire plant regeneration in mediterranean-type ecosystems
;effects of post-fire logging on california spotted owl occupancy
;effects of prescribed fire on plant α-and ꞵ-diversity and the&#xa0-regulating role of soil in a&#xa0-mesquite-oak savanna
;effects of prescribed fire on prenesting movements of wild turkeys in arkansas
;effects of spatial and temporal variation in environmental conditions on simulation of wildfire spread
;effects of speed, cyclicity, and dimensionality on distancing, time, and preference in human-aerial vehicle interactions
;effects of varicella vaccination on herpes zoster incidence
;effects of wildfire on collaborative management of rangelands: a case study of the 2015 soda fire
;effects of wildfire on soils and watershed processes
;effects of wildfire smoke inhalation on respiratory health
;efficient and lightweight model-predictive iot energy management
;efficient approximation algorithms for minimum cost seed selection with probabilistic coverage guarantee
;efficient cloud-based calibration of input data for forest fire spread prediction
;efficient dataflow modeling of peripheral encoding in the human visual system
;efficient error estimating coding: feasibility and applications
;efficient neural style transfer for volumetric simulations
;efficient self-adaptation through explanation-driven white-box optimization
;elaboration of a wild fire hazard model for the eparchy of pylias (sw-messinia, greece) based upon remote sensing and gis
;election interference and online propaganda campaigns: dynamic interdependencies on facebook, google trends, and the new york times
;electromagnetic fingerprinting of memory heartbeats: system and applications
;eleven-year variability in ecosystem functions and multifunctionality after a wildfire and post-fire management in pine forests of central eastern spain
;embedded ann-based forest fire prediction case study of algeria
;emerging cybersecurity capability gaps in the industrial internet of things: overview and research agenda
;emerging technologies for prevention and monitoring of forest fire
;emerging trends in topobathymetric lidar technology and mapping
;emerging trends in wildfire detection through the lens of computer vision and wildfire emission quantification: a comprehensive survey
;emex australis biology, management and research
;emotion detection in code-mixed roman urdu-english text
;empirical-based models for predicting head-fire rate of spread in australian fuel types
;empowering edge intelligence: a comprehensive survey on on-device ai models
;enabling technologies and techniques for floor identification
;encountering deepfakes: a thematic analysis of comments on a music video featuring deepfake content
;encyclopedia of natural hazards
;end-to-end continual rare-class recognition with emerging novel subclasses
;endemicity of paragonimus and paragonimiasis in sub-saharan africa: a systematic review and mapping reveals stability of transmission in endemic foci for a multi-host parasite system
;energy harvesting and wireless transfer in sensor network applications: concepts and experiences
;energy optimized task mapping for reliable and real-time networked systems
;energy-efficient communications for improving timely progress of intermittent-powered ble devices
;engage and mobilize! understanding evolving patterns of social media usage in emergency management
;engagement or knowledge retention: exploring trade-offs in promoting discussion at news websites
;engaging with under-resourced communities for user research through self-authored videos
;engineering with logic: rigorous test-oracle specification and validation for tcp/ip and the sockets api
;enhanced forest fire susceptibility mapping by integrating feature selection genetic algorithm and bagging-based support vector machine with artificial neural networks
;enhanced mapping of wildfire-burned areas using gnss-reflectometry raw intermediate frequency data
;enhanced multi-zonal forest type classification using yolov8 and eurosat for scalable environmental monitoring
;enhancing alaskan wildfire prediction and carbon flux estimation: a two-stage deep learning approach within a process-based model
;enhancing disaster resilience with uav-assisted edge computing: a reinforcement learning approach to managing heterogeneous edge devices
;enhancing forest fire detection: utilizing vgg16 for high-accuracy image classification and machine learning integration
;enhancing forest fire susceptibility mapping in xichang city, china using dbscan-based non-fire point selection integrated with deep neural network
;enhancing post-fire decision-making: a framework for rapid wildfire impact assessment and evidence-based management planning
;enhancing predictive ability of optimized group method of data handling (gmdh) method for wildfire susceptibility mapping
;enhancing the accuracy of forest monitoring through ai to reduce carbon footprint
;enhancing wildfire spread modelling by building a gridded fuel moisture content product with machine learning
;ensemble learning for landslide susceptibility mapping: a review of machine learning and hybrid approaches
;ensemble transform kalman filter (etkf) for large-scale wildland fire spread simulation using farsite tool and state estimation method
;ensembling machine learning models to identify forest fire-susceptible zones in northeast india
;ensembling of decision trees, knn, and logistic regression with soft-voting method for wildfire susceptibility mapping
;entropy slicing extraction and transfer learning classification for early diagnosis of alzheimer diseases with smri
;environmental and anthropogenic influences on fire patterns in tropical dry deciduous forests
;environmental and socioeconomic impacts of forest fires: a call for multilateral cooperation and management interventions
;environmental audio scene and sound event recognition for autonomous surveillance: a survey and comparative studies
;environmental challenges induced by extensive use of face masks during covid-19: a review and potential solutions
;environmental change and imperial land use in central mongolia: a multiproxy lake record from the vicinity of karakorum over the last 1260 years
;environmental circumstances surrounding bushfire fatalities in australia 1901-2011
;environmental drivers of dry eye disease: a narrative review of pollutants, climate, and indoor exposures with practice recommendations
;environmentally persistent free radicals and other paramagnetic species in wildland-urban interface fire ashes
;epidemic spreading over social networks using large-scale biosensors: a survey
;erlangian approximations for the transient analysis of a fluid queue model for forest fire perimeter
;establishing a spatial framework for investigating pfas in wild game animals: evidence from wild boar livers in brandenburg, germany
;estimating burned area in mato grosso, brazil, using an object-based classification method on a systematic sample of medium resolution satellite images
;estimating diffusion networks: recovery conditions, sample complexity &amp-soft-thresholding algorithm
