;#pray4victims: consistencies in response to disaster on twitter
;(re)collecting craft: reviving materials, techniques, and pedagogies of craft for computational makers
;.: land use history, climate change, institutional capacity and war drive forest fire damage in the siversky donets basin of eastern ukraine: a historical review
;2021 turkey mega forest fires: biodiversity measurements of the iucn red list wildlife mammals in sentinel-2 based burned areas
;20th iberian conference on information systems and technologies, cisti 2025
;2d euclidean distance transform algorithms: a comparative survey
;2nd edition of the international conference on artificial intelligence and green computing, icaigc 2025
;3d bounding box estimation based on cots mmwave radar via moving scanning
;3d virtual worlds and the metaverse: current status and future possibilities
;3d voronoi diagrams of real trees
;3dsager: geospatial entity resolution over 3d objects
;3rd international conference on digital transformation in education and artificial intelligence applications, mostart 2025
;6th sustainability and resilience of coastal management, srcm 2025
;<span>d</span>ifferential post-fire vegetation recovery of boreal plains bogs and margins
;[dangerous states and mental health disorders: perceptions and reality]
;[influence of influenza epidemics on the urban population]
;a 350-year tree-ring fire record from białowieza primeval forest, poland: implications for central european lowland fire history
;a bottom-up perspective on how fire changes ecosystem biogeochemistry via plant-soil interactions
;a brief introduction on proposed early bushfires detection model
;a brief review of machine learning algorithms in forest fires science
;a cellular automata model forest fire spread prediction: the case of the wildfire that swept through spetses island in 1990
;a changing climate is snuffing out post-fire recovery in montane forests
;a class-based approach to word alignment
;a collaborative, cloud-based decision support system for structured wildfire risk mitigation planning
;a combined structural and seasonal approach to assess wildfire susceptibility and hazard in summertime
;a comparative analysis of open-source ai solutions for wildfire detection through video analysis
;a comparative exploration of time series models for wild fire prediction
;a comparative review on wildfire simulators
;a comparative study of genetic algorithm-based ensemble models and knowledge-based models for wildfire susceptibility mapping
;a comparison of open data observatories
;a comparison of two machine learning classification methods for remote sensing predictive modeling of the forest fire in the north-eastern siberia
;a comprehensive framework for learning declarative action models
;a comprehensive review of brain-inspired navigation
;a comprehensive review of causal inference in banking, finance, and insurance
;a comprehensive review of empirical and dynamic wildfire simulators and machine learning techniques used for the prediction of wildfire in australia
;a comprehensive review of llm applications for lung cancer diagnosis and treatment: classification, challenges, and future directions
;a comprehensive review of machine learning-based methods in landslide susceptibility mapping
;a comprehensive review: analyzing machine learning approaches for landslide susceptibility mapping
;a comprehensive survey of fire weather index (fwi) systems and iot applications in peatland fire management
;a comprehensive survey of research towards ai-enabled unmanned aerial systems in pre-, active-, and post-wildfire management
;a comprehensive survey of the machine learning pipeline for wildfire risk prediction and assessment
;a comprehensive survey on parallelization and elasticity in stream processing
;a comprehensive survey on parametric and non-parametric machine learning approaches for bus arrival time prediction
;a comprehensive survey on various cancer prediction using natural language processing techniques
;a comprehensive taxonomy forest fire risk assessment: bridging methodological gaps and proposing future directions
;a computationally efficient method for updating fuel inputs for wildfire behavior models using sentinel imagery and random forest classification
;a conceptual high level multiagent system for wildfire management
;a concise review of artificial intelligence methods for forest-fire monitoring systems
;a continuous asm modelling approach to pacemaker sensing
;a critical review on the charging and transport dynamics of atmospheric radioactive aerosols: fundamentals and advances
;a cross community comparison of muting in conversations of gendered violence on reddit
;a culture of burning: social-ecological memory, social learning and adaptation in australian volunteer fire brigades
;a cutting-edge approach to forest fire region identification through deep learning
;a data assimilation framework for discrete event simulations
;a data-based landslide susceptibility map of africa
;a data-driven approach to predict and classify epileptic seizures from brain-wide calcium imaging video data
;a deep learning ensemble model for wildfire susceptibility mapping
;a deep learning framework: predicting fire radiative power from the combination of polar-orbiting and geostationary satellite data during wildfire spread
;a deep learning model using geostationary satellite data forest fire detection with reduced detection latency
;a design and field methods for monitoring impact on mortality of an oral therapy programme
;a disaster response system based on human-agent collectives
;a dispatch-mediated communication model for emergency response systems
;a distance-based data aggregation technique for periodic sensor networks
;a divide-and-conquer deep learning framework for high-resolution burn map prediction under low computational memory condition
;a drl-based partial charging algorithm for wireless rechargeable sensor networks
;a feature adaptive learning method for high-density semg-based gesture recognition
;a few milli-crab sensitivity from 100 kev to 100 tev
;a fire safety engineering approach to improving community resilience to the impacts of wildfire
;a flexible framework for diverse multi-robot task allocation scenarios including multi-tasking
;a forest fire prediction framework based on multiple machine learning models
;a forest fire prediction model based on cellular automata and machine learning
;a foundation for representing and querying moving objects
;a framework for natural resource management with geospatial machine learning: a case study of the 2021 almora forest fires
;a framework for online hate speech detection on code-mixed hindi-english text and hindi text in devanagari
;a framework to design, develop, and evaluate immersive and collaborative serious games in cultural heritage
;a fuzzy inference and big data analysis algorithm for the prediction of forest fire based on rechargeable wireless sensor networks
;a general-purpose sensing floor architecture for human-environment interaction
;a generative model for surrogates of spatial-temporal wildfire nowcasting
;a gis-based fire spread simulator integrating a simplified physical wildland fire model and a wind field model
;a gis-based forest fire risk mapping and uav deployment planning: the case of izmir
;a gis-supported model for the simulation of the spatial structure of wildland fire, cass basin, new zealand
;a global assessment of intensified heatwaves and air quality
;a global kinetic model for the combustion of the evolved gases in wildland fires
;a global outlook on increasing wildfire risk: current policy situation and future pathways
;a global probability-of-fire (pof) forecast
;a goodness-of-fit test for zero-inflated poisson mixed effects models in tree abundance studies
;a google earth engine approach for anthropogenic forest fire assessment with remote sensing data in rema-kalenga wildlife sanctuary, bangladesh
;a graphical formalism for reasoning about substitution in resource transforming procedures
;a hidden markov model-based acoustic cicada detector for crowdsourced smartphone biodiversity monitoring
;a high-resolution spatial distribution-based integration machine learning algorithm for urban fire risk assessment: a case study in chengdu, china
;a historical analysis of factors driving the daily prioritization of wildland fires in california
;a holistic approach to climate change in the emergency department: direct impact of environmental factors on patients
;a hybrid approach for localisation of sensor nodes in remote locations
;a hybrid feature selection algorithm based on a discrete artificial bee colony for parkinsons diagnosis
;a landslide risk management approach for the stillwater to ngakawau rail corridor (snl96 to 126km) in the lower buller gorge, new zealand
;a landslide susceptibility analysis for buzau county, romania
;a likelihood-based boosting algorithm for factor analysis models with binary data
;a literature review: forest management with neural network and artificial intelligence
;a machine learning model to predict wildfire burn severity for pre-fire risk assessments, utah, usa
;a machine learning solution for operational remote sensing of active wildfires
;a machine learning-based approach for wildfire susceptibility mapping. the case study of the liguria region in italy
;a machine learning-based prediction model for preterm birth in rural areas
;a machine learning-based wildfire susceptibility mapping framework for chinas three-north shelterbelt region
;a matter of perspective: designing immersive character transitions for virtual reality games
;a maximum entropy moment quadrature method for quasi-real-time flight duration reliability assessment of uavs
;a method to analyze multiple social identities in twitter bios
;a method to identify wildfire ignition points and propagation durations from burn scars using genetic algorithms
;a mixed methods literature review and framework for decision factors that may influence the utilization of managed wildfire on federal lands, usa
;a mixed-methods approach to identify archetypes of wildfire management end-users of active fire earth observation satellite data
;a modest increase in fire weather overcomes resistance to fire spread in recently burned boreal forests
;a monthly gridded burned area database of national wildland fire data
;a multi-temporal sentinel-2 and machine learning approach for precision burned area mapping: the sardinia case study
;a multimodal approach for hate and offensive content detection in tamil: from corpus creation to model development
;a neural network model of wildfire spread for arbitrary topography, fuel load distribution, and wind field
;a new algorithm for simulating wildfire spread through cellular automata
;a new avenue for bayesian inference with inla
;a new data mining framework forest fire mapping
;a new paradigm forest fire spread prediction: faster decisions at high resolution
;a new picture of fire extent, variability, and drought interaction in prescribed fire landscapes: insights from florida government records
;a new process for organizing assessments of social, economic, and environmental outcomes: case study of wildland fire management in the usa
;a news-based framework for uncovering and tracking city area profiles: assessment in covid-19 setting
;a novel dataset replenishment strategy integrating time-series insar for refined landslide susceptibility mapping in karst regions
;a novel multi-modal network-based dynamic scene understanding
;a novel three-satellite cooperative system for wildfire detection: autonomous task management and quick response framework
;a novel urban vegetation mapping approach for fire risk assessment: a mediterranean case study
;a novel wildfire digital-twin framework using interactive wildfire spread simulator
;a pantropical analysis of fire impacts and post-fire species recovery of plant life forms
;a physarum-inspired algorithm for minimum-cost relay node placement in wireless sensor networks
;a post-fire reforestation assessment and prioritization tool for the western united states
;a price-per-attention auction scheme using mouse cursor information
;a probabilistic approach to wild fi re spread prediction using a denoising diffusion surrogate model
;a probabilistic approach to wildfire spread prediction using a denoising diffusion surrogate model
;a quadratic morphological deep neural network fusing radar and optical data for the mapping of burned areas
;a quest?!: the secret life of gameworld punctuation
;a real-time web-based wildfire simulation system
;a recent review of fire behavior and fire effects on native vegetation in central chile
;a reference data set for validating 3-d models
;a remote sensing-based approach to estimating the fire spread rate parameter for individual burn patch extraction
;a retrospective approach to valuation of natural resources in wildland fire litigation
;a review of approaches to estimate wildfire plume injection height within large-scale atmospheric chemical transport models
;a review of bayesian networks for spatial data
;a review of forest fire and policy response for resilient adaptation under changing climate in the eastern himalayan region
;a review of forward modelling and retrieval approaches forest soil moisture and vegetation optical depth using l-band radiometry
;a review of genetic algorithm approaches for wildfire spread prediction calibration
;a review of geological and triggering factors influencing landslide susceptibility: artificial intelligence-based trends in mapping and prediction
;a review of machine learning applications in wildfire science and management
;a review of methods and sensors for detecting forest fire
;a review of multisensor data fusion techniques for enhancing wildfire detection accuracy
;a review of olfactory display designs for virtual reality environments
;a review of open access high-resolution data for machine learning-based landslide susceptibility mapping
;a review of prescribed burning effectiveness in fire hazard reduction
;a review of public safety power shutoffs (psps) for wildfire mitigation: policies, practices, models and data sources
;a review of recent advances in risk analysis for wildfire management
;a review of recent forest and wildland fire management decision support systems research
;a review of risk assessment of transmission lines under wildfire disaster
;a review of routing techniques for different applications in wireless sensor network
;a review of simulation experiment techniques used to analyze wildfire effects on water quality and supply
;a review of the application of support vector machines in landslide susceptibility mapping
;a review of the effects of forest fire on soil properties
;a review of the effects of wildfire smoke on the health and behavior of wildlife
;a review of the incidence of medium and high voltage overhead electric power lines in causing forest fires
;a review of the literature on wildfires in the context of climate change
;a review of the main driving factors of forest fire ignition over europe
;a review of the operational use of uas in public safety emergency incidents
;a review of the relationships between drought and forest fire in the united states
;a review of the use of gis and remote sensing technologies in monitoring, prediction, and response to natural disasters in the u.s
;a review of two-dimensional cellular automata models for wildfire simulation: methods, capabilities, and limitations
;a review of various analytical techniques for estimating subsurface heat flow regimes from aero-geophysical data
;a review of various landslide susceptibility mapping techniques used in nepal
;a review of wildfire occurrence research
;a review of wildland fire spread modelling, 1990-present 3: mathematical analogues and simulation models
;a review on early forest fire detection systems using optical remote sensing
;a review on early forest fire detection using iot-enabled wsn
;a review on early wildfire detection from unmanned aerial vehicles using deep learning-based computer vision algorithms
;a review on forest fire detection and monitoring systems
;a review on forest fire detection techniques
;a review on forest fire detection techniques: past, present, and sustainable future
;a review on forest fire prediction techniques
;a review on landslide susceptibility mapping in malaysia: recent trend and approaches
;a review on landslide susceptibility mapping methods: needs and challenges
;a review on landslide susceptibility mapping research in bangladesh
;a review on wildfire-induced changes in soil and surface water chemistry
;a review paper on landslide susceptibility mapping using geospatial technology and machine learning techniques
;a review: mechanism of ground fissure development in coalfield fire areas and its mutually reinforcing on the spread of coal fire
;a roadmap for integrating sustainability into software engineering education
;a roll call analysis of the healthy forests restoration act and constituent interests in fire policy
;a sampling-based framework for hypothesis testing on large attributed graphs
;a scenario-based dvfs-aware hybrid application mapping methodology for mpsocs
;a scoping review on the use of machine learning in research on social determinants of health: trends and research prospects
;a scoping study on ai affordances in early childhood education: mapping the global landscape, identifying research gaps, and charting future research directions
;a secure and intelligent data sharing scheme for uav-assisted disaster rescue
;a self-checking rram-based puf with reliability-quantified crps via resistance-delay mapping
;a self-sustained cps design for reliable wildfire monitoring
;a semi-supervised wildfire image segmentation network with multi-scale structural fusion and pixel-level contrastive consistency
;a shift from human-directed to undirected wild land disturbances in the usa
;a short survey of human mobility prediction in epidemic modeling from transformers to llms
;a smart bushfire monitoring and detection system using gsm technology
;a smart disaster management framework for wildfire detection and prediction
;a smart forest fire detection and notification system using iot and machine learning
;a social media study on demographic differences in perceived job satisfaction
;a soil moisture and vegetation-based susceptibility mapping approach to wildfire events in greece
;a statistical investigation of how slope affects a wildfires rate of spread
;a stochastic model for forest fire growth
;a study of complex deep learning networks on high-performance, neuromorphic, and quantum computers
;a study on varieties of computer intelligent models for early detection of prostate cancer
;a suggested model for mass fire spread
;a supervised learning approach for authorship attribution of bengali literary texts
;a survey of 3d space path-planning methods and algorithms
;a survey of adaptation of large language models to idea and hypothesis generation: downstream task adaptation, knowledge distillation approaches and challenges
;a survey of artificial intelligence integrating image processing techniques for predicting solar energy production: challenges and innovations
;a survey of cell decomposition-based path planning
;a survey of deep learning methods for vision-based fire detection and localization
;a survey of deep learning-based object detection methods and datasets for overhead imagery
;a survey of fake news: fundamental theories, detection methods, and opportunities
;a survey of flow field and combustion characteristics under subatmospheric pressure
;a survey of information cascade analysis: models, predictions, and recent advances
;a survey of information dissemination model, datasets, and insight
;a survey of intrusion detection systems leveraging host data
;a survey of machine learning algorithms based forest fires prediction and detection systems
;a survey of micro-video analysis
;a survey of mobile crowdsensing techniques: a critical component for the internet of things
;a survey of modelling trends in temporal gis
;a survey of next-generation computing technologies in space-air-ground integrated networks
;a survey of offensive language detection for the arabic language
;a survey of predictive modeling on imbalanced domains
;a survey of quantum-cognitively inspired sentiment analysis models
;a survey of the machine learning models for forest fire prediction and detection
;a survey of uncertainty in deep neural networks
;a survey of various propagation models for mobile communication
;a survey of vision-based fire detection using convolutional neural networks
;a survey of word reordering in statistical machine translation: computational models and language phenomena
;a survey on automated dynamic malware-analysis techniques and tools
;a survey on automatic credibility assessment using textual credibility signals in the era of large language models
;a survey on cancer prediction and detection with data analysis
;a survey on computational metaphor processing
;a survey on deep learning based forest environment sound classification at the edge
;a survey on deep learning: algorithms, techniques, and applications
;a survey on dialect arabic processing and analysis: recent advances and future trends
;a survey on distributed machine learning
;a survey on ensemble learning approaches for classification of real time covid-19 data and forecasting severity of the epidemic
;a survey on forest fire monitoring using unmanned aerial vehicles
;a survey on hypergraph mining: patterns, tools, and generators
;a survey on iot big data: current status, 13 vs challenges, and future directions
;a survey on iot ground sensing systems for early wildfire detection: technologies, challenges, and opportunities
;a survey on landslide susceptibility mapping using soft computing techniques
;a survey on machine learning and internet of medical things-based approaches for handling covid-19: meta-analysis
;a survey on machine learning in hardware security
;a survey on mathematical, machine learning and deep learning models for covid-19 transmission and diagnosis
;a survey on multidimensional scaling
;a survey on nlp tasks, resources and techniques for low-resource telugu-english code-mixed text
;a survey on requirements of future intelligent networks: solutions and future research directions
;a survey on roughness measurements
;a survey on sars-cov-2 (covid-19) using machine learning techniques
;a survey on seismic sensor based target detection, localization, identification, and activity recognition
;a survey on silicon photonics for deep learning
;a survey on social-physical sensing: an emerging sensing paradigm that explores the collective intelligence of humans and machines
;a survey on spatio-temporal data analytics systems
;a survey on systematic approaches in managing forest fires
;a survey on technologies for automatic forest fire monitoring, detection, and fighting using unmanned aerial vehicles and remote sensing techniques
;a survey on the effects of bumpy road on the vibration of multi-purpose forest fire fighting vehicle
;a survey on the role of centrality as seed nodes for information propagation in large scale network
;a survey on the unmanned aircraft system traffic management
;a survey paper on optimization of leach protocols for efficient clustering in wsn
;a synergistic approach to wildfire prevention and management using ai, machine learning, and 5g technology in the united states
;a synergistic approach using machine learning and deep learning for forest fire susceptibility in himalayan forests
;a system in the wild: deploying a two player arm rehabilitation system for children with cerebral palsy in a school environment
;a systematic literature review on equity and technology in hci and fairness: navigating the complexities and nuances of equity research
;a systematic literature review on leukemia prediction using machine learning
;a systematic machine learning methodology for enhancing accuracy and reducing computational complexity in forest fire detection
;a systematic mapping study on social network privacy: threats and solutions
;a systematic review and bibliometric analysis of wildland fire behavior modeling
;a systematic review and meta-analysis of artificial neural network application in geotechnical engineering: theory and applications
;a systematic review of machine learning based landslide susceptibility mapping
;a systematic review of models for fire spread in wildfires by spotting
;a systematic review of shared sensor networks
;a systematic review of soil erosion susceptibility: trends and insights from 2010 to 2023
;a systematic review of the data, methods and environmental covariates used to map aedes-borne arbovirus transmission risk
;a systematic review of the impacts of climate change on critical infrastructure in canada
;a systematic review of the physical health impacts from non-occupational exposure to wildfire smoke
;a systematic review of urban flood susceptibility mapping: remote sensing, machine learning, and other modeling approaches
;a systematic review on machine learning and deep learning techniques in cancer survival prediction
;a systematic review on modeling methods and influential factors for mapping dengue-related risk in urban settings
;a tale of two fire systems: indigenous fire stewardship in british columbia and california
;a tale of two productions: a christmas carol on stage and in vr
;a taxonomy and survey on grid-based routing protocols designed for wireless sensor networks
;a taxonomy of supervised learning for idss in scada environments
;a technical survey of various methodologies for landslide susceptibility mapping and hazard analysis
;a three-dimensional approach to general plant fire syndromes
