;#pray4victims: consistencies in response to disaster on twitter
;impact of climate change on rheumatology care: a global perspective
;impact of deep learning in analytics of climate change: a survey
;impact of fire-burn on soil geochemical, microbial biomass and carbon stocks in a dry tropical forest ecosystem
;impact of forest fire on physical, chemical and biological properties of soil: a review
;impact of land uses, drought, flood, wildfire, and cascading events on water quality and microbial communities: a review and analysis
;impact of post-anthropogenic forest fire on soil carbon dynamics and physicochemical properties in tropical dry deciduous sulia reserve forest, odisha
;impact of prescribed fire on fungal communities in scots pine (pinus sylvestris) forests in mediterranean transitional zones
;impact of wildfire on permafrost landscapes: a review of recent advances and future prospects
;impact of wildfire smoke on adverse pregnancy outcomes in colorado, 2007-2015
;impacts of changing fire weather conditions on reconstructed trends in u.s. wildland fire activity from 1979 to 2014
;impacts of climate change on fire activity and fire management in the circumboreal forest
;impacts of estimated plume rise on pm2.5 exceedance prediction during extreme wildfire events: a comparison of three schemes (briggs, freitas, and sofiev)
;impacts of fire exclusion and recent managed fire on forest structure in old growth sierra nevada mixed-conifer forests
;impacts of fire-fighting chemicals on native fauna and ecosystems in australia: identification of key knowledge gaps and research priorities
;impacts of wildfire and post-fire land management on hydrological and sediment processes in a humid mediterranean headwater catchment
;impacts of wildfire over land and atmosphere in similipal biosphere reserve, odisha, india
;impacts of wildfire runoff on giant kelp in malibu, california
;implementation of geographical information systems for the study of diseases caused by vector-borne arboviruses in southeast asia: a review based on the publication record
;implementing a pole fire mitigation strategy case study
;implementing biomass co-firing in indonesia to achieve net zero emissions: a comprehensive review and swot analysis
;implications of changing climate for global wildland fire
;importance of combination of ecology and literature
;improve the localization dependability for cyber-physical applications
;improved wildfire spread prediction with time-series data and the wsts+ benchmark
;improving bigraph rewriting with grgen.net to enable efficient system simulation
;improving deep machine learning for early wildfire detection from forest sensory images
;improving forest burned area mapping using weak labels and probabilistic deep learning
;improving fpga-based logic emulation systems through machine learning
;improving geostationary satellite-based prediction of wildfire spread by directional rate of spread adjustment factor
;in vivo detection of oxidative stress and iron deposition by proton exchange rate (kex) mri and quantitative susceptibility mapping for differentiating multiple sclerosis from cerebral small vessel
;in1 measurement of symptoms and impact of influenza: development of the symptom intensity and impact of influenza questionnaire (flu-iiq)
;incorporating pyrodiversity into wildlife habitat assessments for rapid post-fire management: a woodpecker case study
;incorporating short-term forecast mean winds and nwp maximum gusts into effective wind speed for extreme weather-aware wildfire spread prediction
;incorporating stochastic wind vectors in wildfire spread prediction
;incorporating the visibility analysis of fire lookouts for old-growth wood fire risk reduction in the mediterranean island of sardinia
;incorporating user expectations and behavior into the measurement of search effectiveness
;increased appreciation for green infrastructure following bushfires and the covid-19 pandemic: evidence from canberra, australia
;increased fire occurrence benefits early oak regeneration in temperate deciduous forests in part by disrupting an invasive grass-fire feedback
;increasing player performance and game experience in high latency systems
;increasing wildfire in alaskas boreal forest: pathways to potential solutions of a wicked problem
;inculcating context for emoji powered bengali hate speech detection using extended fuzzy svm and text embedding models
;indexing network structure with shortest-path trees
;indices for the evaluation of wildfire spread simulations using contemporaneous predictions and observations of burnt area
;indigenous brigades change the spatial patterns of wildfires, and the influence of climate on fire regimes
;indirectly supervised anomaly detection of clinically meaningful health events from smart home data
;indoor quality-of-position visual assessment using crowdsourced fingerprint maps
;inferring networks of diffusion and influence
;inferring team task plans from human meetings: a generative modeling approach with logic-based prior
;influence estimation and maximization in continuous-time diffusion networks
;influence of climate on atopic dermatitis
;influence of uncertainties in burned area estimates on modeled wildland fire pm2.5 and ozone pollution in the contiguous u.s
;influences and inferences
;information fusion for wireless sensor networks: methods, models, and classifications
;information systems security design methods: implications for information systems development
;infrastructuring community fridges for food commoning
;inherited genetic susceptibility to breast cancer: the beginning of the end or the end of the beginning?
;initiation mechanisms for multiple post-fire debris flow events: insights from the 2021 yaoyao fire in western sichuan, china
;inner-character and inner-word features based representation learning for chinese word embedding
;innovative methodologies for elucidating bushfire smoke-induced pathophysiological mechanism
;inside the inferno: fundamental processes of wildland fire behaviour: part 1: combustion chemistry and heat release
;insight into insiders and it: a survey of insider threat taxonomies, analysis, modeling, and countermeasures
;insights from an experiment crowdsourcing data from thousands of us amazon users: the importance of transparency, money, and data use
;insights from quantitative susceptibility mapping: an umbrella review of multiple sclerosis
;insights provided by a new searchable repository for post-fire hydrology studies and associated data
;institutionalizing predictive ai in public administration: algorithmic governance and the case of a wildfire forecasting system
;insulation property of wire-plane gap under fire condition: effects of vegetation flame conductivity
;integrated fire management as an adaptation and mitigation strategy to altered fire regimes
;integrated fire management in a tropical biosphere reserve: achievements and challenges
;integrated national-scale assessment of wildfire risk to human and ecological values
;integrated simulation and optimization for wildfire containment
;integrated spatial generalized additive modeling forest fire prediction: a case study in fujian province, china
;integrated wildfire danger models and factors: a review
;integrating energy valley optimization with machine learning for flood susceptibility mapping in kayseri, turkiye
;integrating ensemble machine learning and explainable ai for enhanced forest fire susceptibility analysis and risk assessment in turkiyes mediterranean region
;integrating farsite and gis for enhanced forest fire spread prediction and simulation
;integrating fire behavior and pedestrian mobility models to assess potential risk to humans from wildfires within the u.s.-mexico border zone∗
;integrating fire behavior models and geospatial analysis for wildland fire risk assessment and fuel management planning
;integrating fire suppression in forest management
;integrating geo-spatial analysis and gray relational approach for wildfire susceptibility mapping in bale mountain national park, ethiopia
;integrating geomorphological and socio-spatial factors for landslide risk zonation in atenas, costa rica
;integrating geospatial, remote sensing, and machine learning for climate-induced forest fire susceptibility mapping in similipal tiger reserve, india
;integrating iot and machine learning for enhanced forest fire detection and temperature monitoring
;integrating lidar data and semi-empirical fire model in mapping the interaction between wildfire and bark beetle outbreak
;integrating long short-term memory networks and machine learning models for improving explainable wildfire susceptibility assessment
;integrating machine learning algorithms for post-fire damage assessment and rehabilitation prioritization of urban structures
;integrating machine learning models with comprehensive data strategies and optimization techniques to enhance flood prediction accuracy: a review
;integrating remote sensing and gis for advanced forest fire hazards vulnerability and risk assessment in gironde, france
;integrating xai and machine learning for an effective forest fire prediction system
;integration of a deep-learning-based fire model into a global land surface model
;integration of gnss-r derived soil moisture into the usgs wildland fire potential index
;integration of machine learning into geospatial modelling for forest fire risk assessment in hamirpur district, himachal pradesh (india)
;intelligent coaching systems: understanding one-to-many coaching for ill-defined problem solving
;intelligent fire modeling in wildland-urban interface: a comprehensive review of current progress, challenges, and future perspectives
;intelligent monitoring for infectious diseases with fuzzy systems and edge computing: a survey
;intelligent process adaptation in the smartpm system
;intensifying fire season aridity portends ongoing expansion of severe wildfire in western us forests
;interaction models for detecting nodal activities in temporal social media networks
;interactions between rainfall, fire and herbivory drive resprouter vital rates in a semi-arid ecosystem
;interactive invigoration: volumetric modeling of trees with strands
;interactive wood combustion for botanical tree models
;interdisciplinary applications of lidar in forest studies: advances in sensors, methods, and cross-domain metrics
;interferometric sar coherence evaluation of canakkale intepe forest fire in 2008
;intermediate fire severity diversity promotes richness of forest carnivores in california
;internal and external performance fuzzing of well-defined constraints for the b method
;international conference on computational science, iccs 2013 a data-driven model for large wildfire behaviour prediction in europe
;international space station data collection for disaster response
;internet of things (iot)-based applications in smart forestry: a conceptual and technological analysis
;internet of things in e-government: applications and challenges
;internet-of-things enabled forest fire detection system
;internet-scale insecurity of consumer internet of things: an empirical measurements perspective
;interpreting and using outputs from the canadian forest fire danger rating system in research applications
;intraspecific floral scent variation in the context of evolutionary ecology (review) the intricate intracellular structure of a rice mesophyll cell evolution of uv floral patterning in sunflowers
;introducing virtual reality to undergraduate students: a hybrid approach
;introduction for the special issue on big data
;introduction to fire ecology of the northeast: restoring native and cultural ecosystems
;introduction to special issue on computational sustainability
;introduction to the special issue on cooperative decision making
;introduction to the special issue on text-multimedia retrieval: retrieving multimedia data by means of natural language
;introduction: religion, division, and the constitution
;invasive annual grass relationships to environment and grazing vary with species identity
;invasive grass influences on the fire-cycle and treatment effectiveness to control their abundance in the intermountain west, usa
;inventory analysis of fire effects wrought by wind-driven megafires in relation to weather and pre-fire forest structure in the western cascades
;inverse modelling in wildfire spread forecasting: towards a data-driven system
;investigating forest fire causes through an integrated bayesian network and geographic information system approach
;investigating post-wildfire effects in contrasted mediterranean ecosystems
;investigating the performance vs. computational complexity tradeoff in cross-domain fire risk detection
;investigating the use of sentinel-1 for improved mapping of small peatland water bodies: towards wildfire susceptibility monitoring in canadas boreal forest
;investigation of general indicators influencing on forest fire and its susceptibility modeling using different data mining techniques
;investigation of low-moral actions by malicious anonymous operators of avatar robots
;investigation on the association between socio-economic multivariate data and fire incidence based on machine learning method: a case study in shaanxi, china
;invited review: the impact of wildfires, air pollution, and air quality on the health and production of dairy cattle
;iot based forest fire detection and protection system
;iot based forest fire detection using deep learning techniques-a survey
;iot enabled advanced forest fire detecting and monitoring on ubidots platform
;iot inspector: crowdsourcing labeled network traffic from smart home devices at scale
;iot-based fire detection: a comparative study of machine learning techniques
;iot-fog enabled framework for forest fire management system
;iot-inspired framework for real-time prediction of forest fire
;ipsative crystallization effects on wildland fire attitude-policy support models
;iris-rapid response fire spread forecasting system: development, calibration and evaluation
;iron quantification in basal ganglia using quantitative susceptibility mapping in a patient with als: a case report and literature review
;iron quantification in basal ganglia: quantitative susceptibility mapping as a potential biomarker for alzheimers disease-a systematic review and meta-analysis
;is fire for the birds? how two rare species influence fire management across the us
;is land and forest fire in ogan komering ilir, southern sumatera, affected by climate change?
;is wildfire policy in the united states sustainable?
;is wildland fire increasing in sagebrush landscapes of the western united states?
;islands on fire: fire and threatened species patterns across australias islands
;its great because its ran by us: empowering teen volunteer discord moderators to design healthy and engaging youth-led online communities
;its just a natural way of life. an investigation of wildfire preparedness in rural australia
;its the wild, wild west: lessons learned from irb members risk perceptions toward digital research data
;joining sound event detection and localization through spatial segregation
;joint architecture design and workload partitioning for dnn inference on industrial iot clusters
;joint credibility estimation of news, user, and publisher via role-relational graph convolutional networks
;keeper: automated testing and fixing of machine learning software
;knocker: vibroacoustic-based object recognition with smartphones
;knowledge-based textual inference via parse-tree transformations
;koala forest habitat recovery varies with fire severity
;koala response to post-fire recovery of forest habitat
;kronecker graphs: an approach to modeling networks
;label-synchronous neural transducer for adaptable online e2e speech recognition
;lagrangian neural style transfer for fluids
;land use planning and bushfire risk: cfa referrals and the february 2009 victorian fire area
;land-se: a software for statistically based landslide susceptibilityzonation, version 1.0
;land-use history, fire regime, and large-mammal herbivory affect deer-preferred plant diversity in longleaf pine woodlands
;landfire: a nationally consistent vegetation, wildland fire, and fuel assessment
;landsat time series and lidar as predictors of live and dead basal area across five bark beetle-affected forests
;landsat-8 and sentinel-2 based forest fire burn area mapping using machine learning algorithms on gee cloud platform over uttarakhand, western himalaya
;landscape fire pm<sub>2.5</sub> and hospital admissions for cause-specific cardiovascular disease in urban china
;landscape fires as social disasters: an overview of the bushfire problem
;landscape identity, before and after a forest fire
;landscape-scale fuel treatment and wildfire impacts on carbon stocks and fire hazard in california spotted owl habitat
;landscape-wildfire interactions in southern europe: implications for landscape management
;landscaping defensible space: plant flammability testing informs recommendations to reduce community fire hazard
;landslide analysis approaches in tropical environment region for disaster risk reduction
;landslide and wildfire susceptibility assessment in southeast asia using ensemble machine learning methods
;landslide hazard and risk mapping-a review and classification
;landslide inventory maps: new tools for an old problem
;landslide prediction validation in western north carolina after hurricane helene
;landslide susceptibility evaluation and hazard zonation techniques-a review
;landslide susceptibility mapping and assessment: a review
;landslide susceptibility mapping core-base factors and models performance variability: a systematic review
;landslide susceptibility mapping in bijar city, kurdistan province, iran: a comparative study by logistic regression and ahp models
;landslide susceptibility mapping in brazil: a review
;landslide susceptibility mapping in complex topo-climatic himalayan terrain, india using machine learning models: a comparative study of xgboost, rf and ann
;landslide susceptibility mapping: application of novel hybridization of rotation forests (rf) and java decision trees (j48)
;landslide susceptibility mapping: development towards a machine learning-based model
;landslide susceptibility mapping: literature review and findings
;landslide susceptibility modeling in a landslide prone area in mazandarn province, north of iran: a comparison between glm, gam, mars, and m-ahp methods
;landslides and engineering geology of the seattle, washington, area
;landslides in the andes and the need to communicate on an interandean level on landslide mapping and research
;laps: lidar-assisted placement of wireless sensor networks in forests
;large language models in crisis informatics for zero and few-shot classification
;large wildfires alter the potential capacity of fire-prone mediterranean pine forests to provide wild edible mushrooms over the long term
;large-scale assessment of antimicrobial resistance marker databases for genetic phenotype prediction: a systematic review
;large-scale risk mapping of an eruptive bark beetle-importance of forest susceptibility and beetle pressure
;late breaking papers from the 27th international conference on human-computer interaction, hci international 2025
;late pleistocene emergence of an anthropogenic fire regime in australias tropical savannahs
;late-glacial and holocene shifts in the mountain landscapes of the cantabrian range (northern spain) in response to changing climate, fire occurrence and land use
;latency-efficient data collection scheduling in battery-free wireless sensor networks
;latency-optimized scheduling for data aggregation in distributed edge computing
;learning laplacian matrix from graph signals with sparse spectral representation
;learning mixed latent tree models
;learning to coexist with wildfire
;learning to reconstruct botanical trees from single images
;learning-based prediction of wildfire spread with real-time rate of spread measurement
;lens depth function and k-relative neighborhood graph: versatile tools for ordinal data analysis
;lessons learned from a human-centered design of an immersive exergame for people with dementia
;leveraging blockchain and machine learning to promote child labor-free sustainable development
;leveraging drone-assisted surveillance for effective forest conservation: a case study in australias daintree rainforest
;leveraging genome-wide association studies to better understand the etiology of cancers
;leveraging hyperledger fabric for enhanced compliance monitoring in uav operations
;leveraging large language models for explainable activity recognition in smart homes: a critical evaluation
;leveraging nasa soil moisture active passive for assessing fire susceptibility and potential impacts over australia and california
;leveraging similarity joins for signal reconstruction
;leveraging social feedback to verify online identity claims
;life on wings: relating to a birds life in a city through a board game
;lifting the unbearable weight of morbid obesity
;lightweight and locality-aware composition of black-box subroutines
;lightweight deep learning for resource-constrained environments: a survey
;limeade: from ai explanations to advice taking
;limitations and utilisation of monitoring trends in burn severity products for assessing wildfire severity in the usa
;linguistic signals under misinformation and fact-checking: evidence from user comments on social media
;linguistics: the garden and the bush*
;link recommendation for social influence maximization
;linking flood susceptibility mapping and governance in mexico for flood mitigation: a participatory approach model
;linu-mamba: visual mamba u-net with linear attention to predict wildfire spread
;lit: lightning-fast in-memory temporal indexing
;live fuel moisture content modeling and mapping using spectral, meteorological, and topographic data
;lived experience of a record wildfire season in the northwest territories, canada
;living on the edge: trailing edge forests at risk of fire-facilitated conversion to non-forest
;living with bushfire risk: social and environmental influences on preparedness
;living with wildfire in santa fe, new mexico: 2024 data report
;living with wildfire: cultivating a stewardship framework
;local and global pyrogeographic evidence that indigenous fire management creates pyrodiversity
;local community participation and volunteerism in wildfire area management: a systematic review
;localization of wireless sensor networks in the wild: pursuit of ranging quality
;location reference recognition from texts: a survey and comparison
;long-term comparison shows protected and non-protected forests differ in harvesting, but not in wildfires or drought-driven dieback
;long-term frequent fire and cattle grazing alter dry forest understory vegetation
;long-term hydrologic recovery after wildfire and post-fire forest management in the interior pacific northwest
;long-term measurement and analysis of the free proxy ecosystem
;long-term monitoring of aspen forest regeneration and ungulate use shows successful recruitment amid landscape-scale forest restoration
;longitudinal propagation of aquatic disturbances following the largest wildfire recorded in new mexico, usa
;lookout! interactive camera gimbal controller for filming long takes
;lora networking techniques for large-scale and long-term iot: a down-to-top survey
;low-and high-intensity fire in the riparian savanna: demographic impacts in an avian model species and implications for ecological fire management
;low-cost outdoor air quality monitoring and sensor calibration: a survey and critical analysis
;low-cost security for next-generation iot networks
;low-power status updates via sleep-wake scheduling
;low-power tinyos tuned processor platform for wireless sensor network motes
;lp samplers and their applications: a survey
;lung cancer prediction using machine learning: a systematic review
;machine learning and deep learning for wildfire spread prediction: a review
;machine learning at the network edge: a survey
;machine learning based forest fire susceptibility assessment of manavgat district (antalya), turkey
;machine learning based wildfire area estimation leveraging weather forecast data
;machine learning based wildfire susceptibility mapping using remotely sensed fire data and gis: a case study of adana and mersin provinces, turkey
;machine learning for flood susceptibility mapping of the chennai floods of 2023
;machine learning for the built heritage archaeological study
;machine learning in earth system science applications using satellite data
;machine learning in mental health: a systematic review of the hci literature to support the development of effective and implementable ml systems
;machine learning methods for wildfire risk assessment
;machine learning models using shapley additive explanation for fire risk assessment mode and effects analysis of stadiums
;machine learning role in cognitive mental health analysis amid covid-19 crisis: a critical study
;machine learning techniques for gully erosion susceptibility mapping: a review
;machine learning techniques forest fire prediction: current trends, challenges and future directions
;machine learning wildfire susceptibility mapping for germany
;machine learning-based caching and tiering in modern data storage systems: a survey
;machine learning-based forest fire susceptibility mapping of southern mizoram, a part of indo-burma biodiversity hotspot
;machine learning-based forest fire susceptibility mapping using random forest and cart models
;machine learning-based forest fire vulnerability assessment in subtropical chir pine forests of pakistan
;machine learning-based wildfire susceptibility mapping: a gis-integrated predictive framework
