SEMAN4;2011;Hydrogen sulphide in Rotorua, New Zealand: personal exposure assessment and health effects: a thesis presented in partial fulfilment of the requirements for the degree of Master of Science in Earth
SEMAN4;2011;Estudos Geograficos com Enfase na Geomorfologia: Questoes Teoricas, Metodologicas, Mapeamentos e Aplicacoes em Estudos Ambientais
SEMAN4;2007;Application of remote sensing and geographical information system for the study of mass movements in Lebanon
SEMAN4;2015;International Space Station Data Collection for Disaster Response
SEMAN4;2009;Validation of a neural network model using cross application approaches
SEMAN4;2009;Adopting national vegetation guidelines and the National Vegetation Information System (NVIS) framework in the Northern Territory
SEMAN4;1981;Earthquake maps for developing areas in the San Francisco Bay area
SEMAN4;2008;Visualising Risk for Hill Walkers
SEMAN4;2011;Landslides and Engineering Geology of the Seattle, Washington, Area
SEMAN4;1982;A design and field methods for monitoring impact on mortality of an oral therapy programme
SEMAN4;2009;PIN42 ANALYZING INPATIENT DATA FOR HEPATITIS PATIENTS
SEMAN4;2009;PIN38 PATIENT PREFERENCES AND STATED ADHERENCE FOR HEPATITIS C VIRUS TREATMENTS
SEMAN4;2009;IN1 MEASUREMENT OF SYMPTOMS AND IMPACT OF INFLUENZA: DEVELOPMENT OF THE SYMPTOM INTENSITY AND IMPACT OF INFLUENZA QUESTIONNAIRE (FLU-IIQ)
SEMAN4;2009;PIN39 ASSESSING DISEASE BURDEN FOR MEASLES USING A CLINICAL AND HEALTH OUTCOMES APPROACH: A FOCUS ON LOWER-INCOME COUNTRIES
SEMAN4;2021;Nepalese landslide information system (NELIS): a conceptual framework for a web-based geographical information system for enhanced landslide risk management in Nepal
SEMAN4;2013;Encyclopedia of natural hazards
SEMAN4;2022;Landslide Analysis Approaches in Tropical Environment Region for Disaster Risk Reduction
SEMAN4;2018;UAV or Drones for Remote Sensing Applications [volume 1]
SEMAN4;2010;Risk analysis VII: simulation and hazard mitigation-&, Brownfields V: prevention, assessment, rehabilitation and development of Brownfield Sites
SEMAN4;2012;A Landslide Risk Management Approach for the Stillwater to Ngakawau Rail Corridor (SNL96 to 126km) in the Lower Buller Gorge, New Zealand
SEMAN4;2010;Regulation/ Gene Therapy Initial findings from whole exome sequencing of pediatric morphea lesional on of and in
SEMAN4;2008;Recent Publications of the Pacific Northwest Research Station First and Second Quarters, 2008
SEMAN4;2007;Recent Publications of the Pacific Northwest Research Station, Second Quarter, 2007
SEMAN5;2024;Machine Learning and Deep Learning for Wildfire Spread Prediction: A Review
SEMAN5;2022;A Review of Genetic Algorithm Approaches for Wildfire Spread Prediction Calibration
SEMAN5;2019;Methods for Wildfire Spread Prediction and Their Integration With Remote Sensing Data
SEMAN5;2024;Trending and emerging prospects of physics-based and ML-based wildfire spread models: a comprehensive review
SEMAN5;2025;A Comprehensive Review of Empirical and Dynamic Wildfire Simulators and Machine Learning Techniques used for the Prediction of Wildfire in Australia
SEMAN5;2025;Generative AI as a Pillar for Predicting 2D and 3D Wildfire Spread: Beyond Physics-Based Models and Traditional Deep Learning
SEMAN5;2025;AI for Wildfire Management: From Prediction to Detection, Simulation, and Impact Analysis-Bridging Lab Metrics and Real-World Validation
SEMAN5;2020;Prediction of global spread of COVID-19 pandemic: a review and research challenges
SEMAN5;2025;Wildfire and power grid nexus in a changing climate
SEMAN5;2023;Deep Learning Approaches for Wildland Fires Using Satellite Remote Sensing Data: Detection, Mapping, and Prediction
SEMAN5;????;USING IOT AND ML FOR FOREST FIRE DETECTION, MONITORING, AND PREDICTION: A LITERATURE REVIEW
SEMAN5;2011;Predicting climate change effects on wildfires requires linking processes across scales
SEMAN5;2025;A Probabilistic Approach to Wildfire Spread Prediction Using a Denoising Diffusion Surrogate Model
SEMAN5;2024;CNN-BiLSTM: A Novel Deep Learning Model for Near-Real-Time Daily Wildfire Spread Prediction
SEMAN5;2025;Assessing WildfireGPT: a comparative analysis of AI models for quantitative wildfire spread prediction
SEMAN5;2025;Assessment of deep learning models integrated with weather and environmental variables for wildfire spread prediction and a case study of the 2023 Maui fires
SEMAN5;2025;Probabilistic Wildfire Spread Prediction Using an Autoregressive Conditional Generative Adversarial Network
SEMAN5;2025;Vi-Net: A Hybrid Semantic Segmentation Approach for Enhanced Wildfire Spread Prediction
SEMAN5;2025;Improved Wildfire Spread Prediction with Time-Series Data and the WSTS+ Benchmark
SEMAN5;2025;An Enhanced Wildfire Spread Prediction Using Multimodal Satellite Imagery and Deep Learning Models
SEMAN5;2024;Wildfire spread prediction using geostationary satellite observation data and directional ROS adjustment factor
SEMAN5;2024;Wildfire Spread Prediction in North America Using Satellite Imagery and Vision Transformer
SEMAN5;2024;Comparing Accuracy of Wildfire Spread Prediction Models under Different Data Deficiency Conditions
SEMAN5;2024;Adaptive wildfire spread prediction for complex terrain: modeling the effectiveness of sprinkler systems
SEMAN5;2024;Wildfire Spread Prediction Through Remote Sensing and UAV Imagery-Driven Machine Learning Models
SEMAN5;2023;THE LARGE-SCALE WILDFIRE SPREAD PREDICTION USING A MULTI-KERNEL CONVOLUTIONAL NEURAL NETWORK
SEMAN5;2023;WildfireSpreadTS: A dataset of multi-modal time series for wildfire spread prediction
SEMAN5;2026;U-Net with Hadamard Transform and DCT Latent Spaces for Next-day Wildfire Spread Prediction
SEMAN5;2024;Metaheuristic algorithms for calibration of two-dimensional wildfire spread prediction model
SEMAN5;2024;Wildfire Spread Prediction Using Attention Mechanisms in U2-NET
SEMAN5;2023;FirePred: A hybrid multi-temporal convolutional neural network model for wildfire spread prediction
SEMAN5;2026;Incorporating Short-Term Forecast Mean Winds and NWP Maximum Gusts into Effective Wind Speed for Extreme Weather-Aware Wildfire Spread Prediction
SEMAN5;2023;WFNet: A hierarchical convolutional neural network for wildfire spread prediction
SEMAN5;2023;Incorporating Stochastic Wind Vectors in Wildfire Spread Prediction
SEMAN5;2023;Wildfire Spread Prediction Using Attention Mechanisms in U-NET
SEMAN5;2023;Wildfire Spread Prediction using Machine Learning Algorithms
SEMAN5;2023;Real Time Monitoring of Forest Fires and Wildfire Spread Prediction
SEMAN5;2022;Evolutionary Statistical System Based on Novelty Search: A Parallel Metaheuristic for Uncertainty Reduction Applied to Wildfire Spread Prediction
SEMAN5;2022;Wildfire Spread Prediction Model Calibration Using Metaheuristic Algorithms
SEMAN5;2025;CNN-Based Satellite Imagery Framework for Wildfire Detection and Spread Prediction
SEMAN5;2019;Crowd-Sourced Wildfire Spread Prediction With Remote Georeferencing Using Smartphones
SEMAN5;2016;Wildfire Spread Prediction and Assimilation for FARSITE Using Ensemble Kalman Filtering
SEMAN5;2025;Robust Prediction of Wildfire Spread in Australia
SEMAN5;2018;California Wildfire Spread Prediction using FARSITE and the Comparison with the Actual Wildfire Maps using Statistical Methods
SEMAN5;2025;Wildfire Prediction and Spread Detection
SEMAN5;2024;Exploring Directions for Establishing Forest Fire Containment Lines through Forest Fire Spread Prediction Simulations: A Case Study of 2022 Uljin-Samcheok Wildfire
SEMAN5;2024;Shapley-based interpretation of deep learning models for wildfire spread rate prediction
SEMAN5;2024;Experimental and numerical study on data-driven prediction for wildfire spread incorporating adaptive observation error adjustment
SEMAN5;????;A probabilistic approach to wild fi re spread prediction using a denoising diffusion surrogate model
SEMAN5;2025;Conceptual Clarity in Fire Science: A Systematic Review Linking Climatic Factors to Wildfire Occurrence and Spread
SEMAN5;2013;Applying Probability Theory for the Quality Assessment of a Wildfire Spread Prediction Framework Based on Genetic Algorithms
SEMAN5;2026;RCDA-Net: a residual contextual dual attention network for wildfire spread region prediction
SEMAN5;2023;Rapid prediction of wildfire spread using ensemble Kalman filter and polyline simplification
SEMAN5;2024;Wildfire Risk Prediction: A Review
SEMAN5;2025;Comparative and Interpretative Analysis of CNN and Transformer Models in Predicting Wildfire Spread Using Remote Sensing Data
SEMAN5;2021;Multifidelity prediction in wildfire spread simulation: Modeling, uncertainty quantification and sensitivity analysis
SEMAN5;2024;Advancements in Wildfire Prediction and Detection: A Systematic Review
SEMAN5;2025;FireSentry: A Multi-Modal Spatio-temporal Benchmark Dataset for Fine-Grained Wildfire Spread Forecasting
SEMAN5;2025;LinU-Mamba: Visual Mamba U-Net with Linear Attention to Predict Wildfire Spread
SEMAN5;2025;Deep-learning-based dynamic early warning and spread prediction model for wildfires along transmission lines
SEMAN5;2025;MFiSP: A Multimodal Fire Spread Prediction Framework
SEMAN5;2025;Simulating wildfire spread based on continuous time series remote sensing images and cellular automata
SEMAN5;2024;Application of Explainable Artificial Intelligence in Predicting Wildfire Spread: An ASPP-Enabled CNN Approach
SEMAN5;2025;Wildfire spread forecasting with Deep Learning
SEMAN5;2025;From Convolution to Attention: Transformer-Based Modeling for Multi-Day Wildfire Spread Forecasting
SEMAN5;2022;Rapid prediction of wildfire spread using ensemble Kalman filter and polyline simplification
SEMAN5;2024;Advancements in Wildfire Detection and Prediction: An In-Depth Review
SEMAN5;2022;Prediction of wildfire rate of spread in grasslands using machine learning methods
SEMAN5;2020;Learning-based prediction of wildfire spread with real-time rate of spread measurement
SEMAN5;2022;Wildfire Path Prediction Spread using Machine Learning
SEMAN5;2025;Exploration of geo-spatial data and machine learning algorithms for robust wildfire occurrence prediction
SEMAN5;2024;Fire spread prediction model based on multi-scale convolutional neural network
SEMAN5;2024;A Deep Learning Framework: Predicting Fire Radiative Power From the Combination of Polar-Orbiting and Geostationary Satellite Data During Wildfire Spread
SEMAN5;2024;Advancing Wildfire Predictive Models: A Novel Dataset for Next-Day Wildfire Spread
SEMAN5;2024;Assimilating UAV-Based Observation Data for Wildfire Spread Simulation
SEMAN5;2024;The distributed strategy for asynchronous observations in data-driven wildland fire spread prediction
SEMAN5;2024;Wildfire spreading prediction using multimodal data and deep neural network approach
SEMAN5;2024;Evaluation of an In-Canopy Wind and Wind Adjustment Factor Model for Wildfire Spread Applications Across Scales
SEMAN5;2025;Bridging spatiotemporal wildfire prediction and decision modeling using transformer networks and fuzzy inference systems
SEMAN5;2025;An integrated framework for wildfire emergency response and post-fire debris flow prediction: a case study from the wildfire event on 20 April 2021 in Mianning, Sichuan, China
SEMAN5;2025;An Intelligent Hybrid Model for Wildfire Prediction and Environmental Risk Management
SEMAN5;2023;Facing the Wildfire Spread Risk Challenge: Where Are We Now and Where Are We Going?
SEMAN5;2025;AI-Driven Approaches to Wildfire Prediction and Control: Methods, Challenges, and Future Direction
SEMAN5;2019;Predicting fire spread and behaviour on the fireline. Wildfire analyst pocket: A mobile app for wildland fire prediction
SEMAN5;2025;Modeling Neighborhoods as Fuel for Wildfire: A Review
SEMAN5;2023;Advances in the prediction of spread through air spaces with imaging in lung cancer: a narrative review
SEMAN5;2024;Forecasting Hourly Wildfire Risk: Enhancing Fire Danger Assessment using Numerical Weather Prediction
SEMAN5;2024;Firecast Zigzag Convolutional Network for Wildfire Prediction
SEMAN5;2024;Wildfire Autonomous Response and Prediction Using Cellular Automata (WARP-CA)
SEMAN5;2024;PyroScan: Wildfire Behavior Prediction System using Unmanned Aerial Vehicles (UAV)
SEMAN5;2025;Wildfire Detection: Review of Emerging Technologies and Methodologies
SEMAN5;2024;Predicting the rate of spread of mixed-fuel surface fires in northeastern China using the Rothermel wildfire behaviour model: a laboratory study
SEMAN5;2024;Enhancing Alaskan wildfire prediction and carbon flux estimation: a two-stage deep learning approach within a process-based model
SEMAN5;2025;Predicting Wildfire Spread with Machine Learning and a Socio-Ecological Approach to Identify Areas of High Vulnerability
SEMAN5;2023;A new paradigm forest fire spread prediction: Faster decisions at high resolution
SEMAN5;2025;A Neural Network Model of Wildfire Spread for Arbitrary Topography, Fuel Load Distribution, and Wind Field
SEMAN5;2025;Asymmetric Cell-DEVS Wildfire Spread Using GIS Data
SEMAN5;2025;Fire-EnSF: Wildfire Spread Data Assimilation using Ensemble Score Filter
SEMAN5;2025;Systematic Literature Review on the Application of Mathematics, Statistics, and Computer Science in Wildfire Analysis
SEMAN5;2024;Deep Learning for Wildfire Risk Prediction: Integrating Remote Sensing and Environmental Data
SEMAN5;2016;Prediction of Wildfire Spread and Propagation Algorithm for Disaster Area
SEMAN5;2026;Robust Wildfire Forecasting under Partial Observability: From Reconstruction to Prediction
SEMAN5;2022;Modeling Wildfire Spread with an Irregular Graph Network
SEMAN5;2023;Prediction capability of the MCDA-AHP model in wildfire risk zonation of a protected area in the Southern Western Ghats
SEMAN5;2025;Sensitivity to the Representation of Wind for Wildfire Rate of Spread: Case Studies with the Community Fire Behavior Model
SEMAN5;2026;Trustworthy Data-Driven Wildfire Risk Prediction and Understanding in Western Canada
SEMAN5;2023;Paying Attention to Wildfire: Using U-Net with Attention Blocks on Multimodal Data for Next Day Prediction
SEMAN5;2025;Explainable AI-Driven Wildfire Prediction in Australia: SHAP and Feature Importance to Identify Environmental Drivers in the Age of Climate Change
SEMAN5;2022;Efficient Cloud-Based Calibration of Input Data for Forest Fire Spread Prediction
SEMAN5;2021;Forest fire spread prediction using deep learning
SEMAN5;2024;Dynamic correction of forest fire spread prediction using observation error covariance matrix estimation technique based on FLC-GRU
SEMAN5;2026;A Review of Two-Dimensional Cellular Automata Models for Wildfire Simulation: Methods, Capabilities, and Limitations
SEMAN5;2019;FireCast: Leveraging Deep Learning to Predict Wildfire Spread
SEMAN5;2025;Challenges and Opportunities in Remote Sensing-Based Fuel Load Estimation for Wildfire Behavior and Management: A Comprehensive Review
SEMAN5;2021;Uncertainty quantification of forecast error in coupled fire-atmosphere wildfire spread simulations: sensitivity to the spatial resolution
SEMAN5;2026;Wildfire Spread Scenarios: Increasing Sample Diversity of Segmentation Diffusion Models with Training-Free Methods
SEMAN5;2026;Stochastic modeling of wildfire spread using deep recurrent neural networks: a data-driven computational approach for analyzing natural hazards
SEMAN5;2021;Cloud-Based Urgent Computing for Forest Fire Spread Prediction under Data Uncertainties
SEMAN5;2023;Generative Algorithms for Fusion of Physics-Based Wildfire Spread Models with Satellite Data for Initializing Wildfire Forecasts
SEMAN5;2026;Wind Speed Prediction Based on AM-BiLSTM Improved by PSO-VMD for Forest Fire Spread
SEMAN5;2019;Modeling wildfire spread in wildland-industrial interfaces using dynamic Bayesian network
SEMAN5;2024;Assessment and Validation of a Computer Vision Algorithm for Wildfire Rate of Spread Estimation
SEMAN5;2020;Enhancing wildfire spread modelling by building a gridded fuel moisture content product with machine learning
SEMAN5;2024;Prediction of Wildfire Occurrence in the Southern Forest Regions of China in the Future Scenario
SEMAN5;2025;A Systematic Review of Models for Fire Spread in Wildfires by Spotting
SEMAN5;2020;Early Adaptive Evaluation Scheme for Data-Driven Calibration in Forest Fire Spread Prediction
SEMAN5;2021;Derivation of a Bayesian fire spread model using large-scale wildfire observations
SEMAN5;2019;A novel wildfire digital-twin framework using interactive wildfire spread simulator
SEMAN5;2019;Coupling wildfire spread and erosion models to quantify post-fire erosion before and after fuel treatments
SEMAN5;2022;Towards a Comprehensive Dataset for Next-Day Wildfire Prediction
SEMAN5;2023;Impacts of estimated plume rise on PM2.5 exceedance prediction during extreme wildfire events: a comparison of three schemes (Briggs, Freitas, and Sofiev)
SEMAN5;????;Application of Arti fi cial Intelligence-Based Regression Methods in the Problem of COVID-19 Spread Prediction: A Systematic Review
SEMAN5;2020;Coupling wildfire spread and erosion models to quantify post-fire erosion in Northern Sardinia, Italy
SEMAN5;2024;Wildfire smoke and health impacts: a narrative review
SEMAN5;2026;Spatio-temporal patterns and drivers of fire spread and severity: a case study of an extreme wildfire in China's boreal forests
SEMAN5;2022;Recurrent Convolutional Deep Neural Networks for Modeling Time-Resolved Wildfire Spread Behavior
SEMAN5;2022;Software-Based Simulations of Wildfire Spread and Wind-Fire Interaction
SEMAN5;2023;Wildfire Progression Prediction and Validation Using Satellite Data and Remote Sensing in Sonoma, California
SEMAN5;2019;Delft University of Technology Modeling wildfire spread in wildland-industrial interfaces using dynamic Bayesian network
SEMAN5;2020;A review of machine learning applications in wildfire science and management
SEMAN5;2017;Spatial Partition-Based Particle Filtering for Data Assimilation in Wildfire Spread Simulation
SEMAN5;2016;Short-term fire front spread prediction using inverse modelling and airborne infrared images
SEMAN5;2018;Generation and evaluation of ensemble simulations of wildfire spread for probabilistic forecast
SEMAN5;2023;Integrated wildfire danger models and factors: A review
SEMAN5;2018;DATA-DRIVEN SIMULATIONS OF WILDFIRE SPREAD AT REGIONAL SCALES
SEMAN5;2018;Inverse modelling in wildfire spread forecasting: towards a data-driven system
SEMAN5;2023;FireSight: Utilizing Deep Learning for Wildfire Prediction And Determining Escape Routes
SEMAN5;2008;A cellular automata model forest fire spread prediction: The case of the wildfire that swept through Spetses Island in 1990
SEMAN5;2020;Evaluating the 10% wind speed rule of thumb for estimating a wildfire's forward rate of spread against an extensive independent set of observations
SEMAN5;2020;Review of Wildfire Management Techniques-Part I: Causes, Prevention, Detection, Suppression, and Data Analytics
SEMAN5;2021;Statistical Modeling for the Prediction of Infectious Disease Dissemination With Special Reference to COVID-19 Spread
SEMAN5;2016;Indices for the evaluation of wildfire spread simulations using contemporaneous predictions and observations of burnt area
SEMAN5;2015;Role of buoyant flame dynamics in wildfire spread
SEMAN5;2020;Wildfire Prediction: Handling Uncertainties Using Integrated Bayesian Networks and Fuzzy Logic
SEMAN5;2025;Wildfire Detection Based on Satellite Images Using Deep Learning
SEMAN5;2025;Machine Learning based Wildfire Area Estimation Leveraging Weather Forecast Data
SEMAN5;2025;Green Firebreaks: Potential to Proactively Complement Wildfire Management
SEMAN5;2015;Effects of spatial and temporal variation in environmental conditions on simulation of wildfire spread
SEMAN5;2025;Generative Algorithms for Wildfire Progression Reconstruction from Multi-Modal Satellite Active Fire Measurements and Terrain Height
SEMAN5;2022;Prediction of Wildfire Fuel Load for Pinus densiflora Stands in South Korea Based on the Forest-Growth Model
SEMAN5;2025;Dynamic UAV Path Planning Under Wildfire Scenarios Using PPO Algorithm
SEMAN5;2025;A Semi-Supervised Wildfire Image Segmentation Network with Multi-Scale Structural Fusion and Pixel-Level Contrastive Consistency
SEMAN5;2020;Agent-based modelling for wildfire behaviour prediction
SEMAN5;2025;Comparing Satellite Data for Next-Day Wildfire Predictability
SEMAN5;2025;Comparing Next-Day Wildfire Predictability of MODIS and VIIRS Satellite Data
SEMAN5;2025;The Missing Wind in Wildfire Science
SEMAN5;2025;Spatial Uncertainty Quantification in Wildfire Forecasting for Climate-Resilient Emergency Planning
SEMAN5;2025;Machine learning methods for wildfire risk assessment
SEMAN5;2022;Urban traffic flow prediction techniques: A review
SEMAN5;2020;Abstract Submitted for the DFD20 Meeting of The American Physical Society Ensemble Predictions of Wildfire Spread Through TPU-Compatible TensorFlow Acceleration1
SEMAN5;2024;Firefighting Drone Configuration and Scheduling for Wildfire Based on Loss Estimation and Minimization
SEMAN5;2018;Real-time fire segmentation via Active Contours for UAV integrated wildfire propagation prediction
SEMAN5;2025;Rapid simulation of grassland fire spread with parameterized flame plume entrainment effects
SEMAN5;2021;A Statistical Investigation of how Slope affects a Wildfire's Rate of Spread
SEMAN5;2016;Deciphering the impact of uncertainty on the accuracy of large wildfire spread simulations
SEMAN5;2018;Combining MCTS and A3C for Prediction of Spatially Spreading Processes in Forest Wildfire Settings
SEMAN5;2022;A systematic review on machine learning and deep learning techniques in cancer survival prediction
SEMAN5;2016;Predicting wildfire spread and behaviour in Mediterranean landscapes
SEMAN5;2025;AI-Powered Plant Science: Transforming Forestry Monitoring, Disease Prediction, and Climate Adaptation
SEMAN5;2021;A review of the effects of wildfire smoke on the health and behavior of wildlife
SEMAN5;2021;A review of the effects of wildfire smoke on the health and behavior of wildlife
SEMAN5;2018;AdriaFirePropagator and AdriaFireRisk: user friendly Web based wildfire propagation and wildfire risk prediction software
SEMAN5;2024;Using Drone Swarm to Stop Wildfire: A Predict-then-optimize Approach
SEMAN5;2014;Coupled Dynamic Data-Driven Framework for Forest Fire Spread Prediction
SEMAN5;2026;Adapting Video Foundation Models for Spatiotemporal Wildfire Forecasting via Cross-Modal Progressive Fine-Tuning
SEMAN5;2026;Generative Algorithms for Wildfire Progression Reconstruction from Multi-Modal Satellite Active Fire Measurements and Terrain Height
SEMAN5;2026;Conformal Risk Control for Safety-Critical Wildfire Evacuation Mapping: A Comparative Study of Tabular, Spatial, and Graph-Based Models
SEMAN5;2026;Investigating post-wildfire effects in contrasted Mediterranean ecosystems
SEMAN5;2023;Systematic Review on Prediction and Monitoring of Climate Change
SEMAN5;2026;Experimental and Numerical Study of Vegetation Moisture Content on Wildfire Intensity: The Seasonal Effect
SEMAN5;2025;Next-Generation AI for Firefighter Hazard Prediction: Exploring BERT and Doc2Vec to Advance Safety and Risk Intelligence
SEMAN5;2025;Convective potential and fuel availability complement near-surface weather in regulating global wildfire activity
SEMAN5;2024;Using cellular automata and multi-criteria evaluation to simulate the wildfire expansion in Prince George, British Co-lumbia
SEMAN5;2025;Advancements in Artificial Intelligence Applications for Forest Fire Prediction
SEMAN5;2024;Assessment of Wildfire Risk on Transmission Assets
SEMAN5;2017;Using Wind Data to Predict Wildfire Spread in Central California
SEMAN5;????;Forecasting and Surveillance of COVID-19 Spread Using Google Trends: Literature Review
SEMAN5;2021;The roles of machine learning methods in limiting the spread of deadly diseases: A systematic review
SEMAN5;2021;Application of machine learning in the prediction of COVID-19 daily new cases: A scoping review
SEMAN5;2025;A Conceptual High Level Multiagent System for Wildfire Management
SEMAN6;2025;AI for Wildfire Management: From Prediction to Detection, Simulation, and Impact Analysis-Bridging Lab Metrics and Real-World Validation
SEMAN6;2024;Machine Learning and Deep Learning for Wildfire Spread Prediction: A Review
SEMAN6;2024;Trending and emerging prospects of physics-based and ML-based wildfire spread models: a comprehensive review
SEMAN6;2025;A Probabilistic Approach to Wildfire Spread Prediction Using a Denoising Diffusion Surrogate Model
SEMAN6;2025;Mapping wildfire dynamics: GeoAI-driven comparative analysis of deep and machine learning ensembles for susceptibility prediction in California
SEMAN6;2025;Wildfire Susceptibility Mapping Using Deep Learning and Machine Learning Models Based on Multi-Sensor Satellite Data Fusion: A Case Study of Serbia
SEMAN6;2025;Applications and Advancements of Spaceborne InSAR in Landslide Monitoring and Susceptibility Mapping: A Systematic Review
SEMAN6;2025;A review of geological and triggering factors influencing landslide susceptibility: artificial intelligence-based trends in mapping and prediction
SEMAN6;2022;A Review of Genetic Algorithm Approaches for Wildfire Spread Prediction Calibration
SEMAN6;2025;Benchmarking Artificial Neural Networks and U-Net Convolutional Architectures for Wildfire Susceptibility Prediction: Innovations in Geospatial Intelligence
SEMAN6;2025;Wildfire Susceptibility Mapping through Machine Learning and Remote Sensing Data with Distance Based Sampling for Fire-Free Points
SEMAN6;2025;Evolution and critical evaluation of deterministic physically based rainfall-induced landslide susceptibility mapping: a mixed review
SEMAN6;2025;Correction: A review of geological and triggering factors influencing landslide susceptibility: artificial intelligence-based trends in mapping and prediction
SEMAN6;2025;A review paper on Landslide Susceptibility Mapping using Geospatial Technology and Machine Learning Techniques
