SEMAN2;2020;Methodological Principles and Applications of the Delphi Method: A Narrative Review
SEMAN2;2024;Temporary Employment in Markets with Frictions
SEMAN2;2023;Review of Research on Human Behavior in Large Outdoor Fires
SEMAN2;2019;Experimental and Comparison Based Study on Diabetes Prediction Using Artificial Neural Network
SEMAN2;2020;Deep Learning Approaches for Detecting COVID-19 From Chest X-Ray Images: A Survey
SEMAN2;2022;Review on the COVID-19 pandemic prevention and control system based on AI
SEMAN2;2022;A Systematic Review and Bibliometric Analysis of Wildland Fire Behavior Modeling
SEMAN2;2018;Forest Fire Detection System Using IoT and Artificial Neural Network
SEMAN2;2014;Uncertainty in model predictions of wildland fire rate of spread
SEMAN2;2021;Survey Paper on Sentiment Analysis Using Machine Learning Techniques
SEMAN2;2020;Wildfire Recurrence at Quilombola Kalunga Territory (GO)
SEMAN2;2018;Trends in fluoroquinolone resistance in Campylobacter
SEMAN2;2025;Habitat for the endangered ephemeral Monotaxis macrophylla (Euphorbiaceae) in New South Wales: how do predictions compare with the evidence?
SEMAN2;2021;Parameter Based Literature Survey of COVID-19 Mortality Dynamics Using Machine Learning Techniques
SEMAN2;2024;Valley fever under a changing climate in the United States
SEMAN2;2020;A recent review of fire behavior and fire effects on native vegetation in Central Chile
SEMAN2;????;A Survey on Ensemble Learning Approaches for Classification of Real Time COVID-19 Data and Forecasting Severity of the Epidemic
SEMAN2;2017;How well has the spread of sudden oak death been predicted by the models in northern California
SEMAN2;2011;Genomic Selection in Plant Breeding
SEMAN2;2016;Survey of Computational Methods in Cyberbullying Research
SEMAN2;2003;A survey of various propagation models for mobile communication
SEMAN2;????;Predicting climate change effects on wildfires requires linking processes across scales
SEMAN2;2006;A survey on roughness measurements
SEMAN2;2014;A Literature Review: Forest Management with Neural Network and Artificial Intelligence
SEMAN2;2017;MACHINE PREDICTS THE DIAGNOSIS A BRIEF REVIEW OF MEDICAL DIAGNOSIS BY MACHINE LEARNING TECHNIQUES
SEMAN2;2021;Deep Learning applications for COVID-19
SEMAN2;2021;Combustion dynamics of large-scale wildfires
SEMAN2;2006;Wildfire evolution in the convective boundary layer
SEMAN2;????;Recent Progress in Understanding Larval Dispersal: New Directions and Digressions
SEMAN2;????;Distribution of threatened crayfishes and spread of an invasive crayfish in the upper Saint Francis River drainage, Missouri
SEMAN2;1996;Random set models of fire spread
SEMAN2;2012;Epidemic Spreading Over Social Networks Using Large-scale Biosensors: A Survey
SEMAN2;2015;Distribution of Corbicula fluminea (Muller, 1774) in the invaded range: a geographic approach with notes on species traits variability
SEMAN2;2009;Modelling the spread of wildland fire under Mediterranean conditions
SEMAN2;2011;NIST GCR 11-953 Wildfire Modeling
SEMAN2;2012;CENTERIS 2012-Conference on ENTERprise Information Systems / HCIST 2012-International Conference on Health and Social Care Information Systems and Technologies Epidemic spreading over social
SEMAN2;1999;The serological response to papillomaviruses
SEMAN2;2019;The Northern California Wildfires of 8-9 October 2017: The Role of a Major Downslope Wind Event
SEMAN2;2014;An Overview of Information Hiding in H.264/AVC Compressed Video
SEMAN2;2020;Gene Expression Profiling Tests for Early-Stage Invasive Breast Cancer: A Health Technology Assessment
SEMAN2;2014;Climate change and the potential spread of Sorghum halepense in the central area of Argentina based on growth, biomass allocation and eco-physiological traits
SEMAN2;2022;Machine Learning Role in Cognitive Mental Health Analysis amid Covid-19 Crisis: A Critical Study
SEMAN2;2017;Intraspecific floral scent variation in the context of evolutionary ecology (Review) The intricate intracellular structure of a rice mesophyll cell Evolution of UV floral patterning in sunflowers
SEMAN2;2021;A Study on Varieties of Computer Intelligent Models for Early Detection of Prostate Cancer
SEMAN2;2014;Climate change and the potential spread of Sorghum halepense in the central area of Argentina based on growth, biomass allocation and eco-physiological traits
SEMAN2;2016;Are forest gullies refuges for birds when burnt? The value of topographical heterogeneity to avian diversity in a fire-prone landscape
SEMAN2;2016;The French Counterrevolutionary Theorist Louis de Bonald (1754-1840) by David Klinck (review)
SEMAN2;2011;Dynamics of change in the practice of female genital cutting in Senegambia: testing predictions of social convention theory
SEMAN2;2020;Characterizing spatial patterns of pine bark beetle outbreaks during the dry and rainy season's in Honduras with the aid of geographic information systems and remote sensing data
SEMAN2;2022;THE IMPACT OF COVID-19 ON THE DIAGNOSIS OF MELANOMA IN BRITISH COLUMBIA
SEMAN2;2012;Fuels and fire behavior dynamics in bark beetle-attacked forests in Western North America and implications for fire management
SEMAN2;2014;Optimization of Lung Cancer using Modern Data Mining Techniques
SEMAN2;2021;Sharing Economy in Russia: A Possible New Source of Political Participation and Democratization?
SEMAN2;1986;The analysis and modelling of British invasions
SEMAN2;2019;Potential impacts of insect-induced harvests in the mixed forests of New England
SEMAN2;2008;Recent advances in metastasis research
SEMAN2;2013;Wildland-urban interface (WUI) fire modelling using PHOENIX Rapidfire: A case study in Cavaillon, France
SEMAN2;2020;Diagnostic accuracy of an app-guided, self-administered test for influenza among individuals presenting to general practice with influenza-like illness: study protocol
SEMAN2;2020;The Present and Future Role for sUAS in Atmospheric Sciences
SEMAN2;2019;The extent of carbapenemase-encoding genes in public genome sequences
SEMAN2;????;Deep Learning Based Cyclone Intensity Estimation Using INSAT-3D IR Imagery
SEMAN2;????;The China Boom: Why China Will Not Rule the World by Ho-fung Hung (review)
SEMAN2;2017;Determinants of West Nile Virus (WNV) incidence in select regions of Canada: an examination of climate and ecological drivers in British Columbia and Saskatchewan
SEMAN2;2021;Deep Learning applications for COVID-19
SEMAN2;2018;Planning for greying cities: age-friendly city planning and design research and practice
SEMAN2;2010;Etats dangereux et troubles psychiques: images et realites
SEMAN2;????;The impact of greenhouse gas emissions and green innovation on corporate investors' financial performance: A systematic review L'impact des emissions de gaz a effet de serre et de l'innovation verte
SEMAN2;2015;Distribution of Corbicula fluminea (Muller, 1774) in the invaded range: a geographic approach with notes on species traits variability
SEMAN2;2014;Evaluating Pre-and Post-Fire Peak Discharge Predictions across Western U.S. Watersheds
SEMAN2;1992;The genetics of plant-virus interactions: implications for plant breeding
SEMAN2;1937;Chapter II: The Measurement and Prediction of Teaching Ability
SEMAN2;2015;Robust shallow water models
SEMAN2;1966;Book Review: The Philosophy of Francis Bacon
SEMAN2;1994;The development of the fire diffusion law by modelling the level of danger and its evolution over time.: comparison with experimental data in Lebanese forests
SEMAN2;2004;Effects of varicella vaccination on herpes zoster incidence
SEMAN2;????;Emex australis biology, management and research
SEMAN2;2002;Operationalization of Meme Selection Criteria: Methodologies to Empirically Test Memetic Predictions
SEMAN2;2010;Using seafloor heat flow as a tracer to map subseafloor fluid flow in the ocean crust
SEMAN2;2011;O1-S11.01 Time evolution of the fraction of new HIV infections due to primary infection among high risk groups in southern India
SEMAN2;2010;[Dangerous states and mental health disorders: perceptions and reality]
SEMAN2;2014;A warm welcome to ' Carbon Cycling: From Plants to Ecosystems ', at the University of Manchester!
SEMAN2;2014;Beware of strange black rats and other stories
SEMAN2;2008;Lifting the unbearable weight of morbid obesity
SEMAN2;2016;Economics and Finance in Emerging Markets
SEMAN2;1983;[Influence of influenza epidemics on the urban population]
SEMAN2;2014;Introduction for the special Issue on BIG DATA
SEMAN2;2013;Sickle-cell disorders: limits of descriptive epidemiology
SEMAN2;2002;The Public Health Implications of Global Warming
SEMAN2;2010;The Semiotic Review of Books
SEMAN2;????;P67. Assessing Risk of Influenza Infection on a College Campus: An Emphasis on Housing Arrangement
SEMAN2;2011;The Movement To Cyberbanking
SEMAN2;2014;BLOCK ORIENTED SYSTEM IDENTIFICATION REPRESENTATION OF PNEUMATIC SEAT BLADDER DESIGN USED FOR VIBRATION ISOLATION
SEMAN2;1996;GIS-supported simulation of the spatial behaviour of wildland fire, Cass Basin, New Zealand
SEMAN2;2012;Fire & Materials, 31 Jan-2 Feb 2011, San Francisco, CA COMPUTER MODELLING OF WILDLAND-URBAN INTERFACE FIRES
SEMAN2;1957;Recent studies on flame stabilization of premixed turbulent gases
SEMAN2;2005;Statistische und Probabilistische Methoden der Modellwahl
SEMAN2;2005;Review of "Bioterrorism: Mathematical modeling applications in homeland security" by H. T. Banks and C. Castillo-Chavez
SEMAN2;2010;THE EXTENT, EFFECTS AND DYNAMICS OF AMPHIBIAN CHYTRIDIOMYCOSIS IN AUSTRALIA
SEMAN2;2006;Mathematisches Forschungsinstitut Oberwolfach Report No. 47 / 2005 Statistische und Probabilistische Methoden der Modellwahl
SEMAN2;2002;Global Climate Change and Air Pollution: Common Origins With Common Solutions
SEMAN2;1994;Mirian E. David, Parents, Gender and Education Reform, Polity Press, Oxford, 1993, ix + 256 pp., £45.00 hard, £12.95 paper.-Philipa Cordingley and Maurice Kogan, In Support Education: Governing the
SEMAN2;2006;World-wide power quality-20-year cycles of development, 1965 to 2025
SEMAN2;2004;A FEW MILLI-CRAB SENSITIVITY FROM 100 KEV TO 100 TEV
SEMAN2;1997;BETTER FORECASTING THROUGH LOOKING BACK
SEMAN2;2002;A REFERENCE DATA SET FOR VALIDATING 3-D MODELS
SEMAN2;2006;Introduction: Religion, Division, and the Constitution
SEMAN2;1997;Why are antibiotic resistance genes so resistant to elimination?
SEMAN2;2023;Solar Intensity Dispersing (SID) Concept for CubeSat Spectral CLARREO-Like Radiance Measurements
SEMAN2;2023;COVID-19 AND RELATED GOVERNMENT REGULATIONS' IMPACT ON EMPLOYMENT IN GEORGIA
SEMAN2;2022;Small Business Innovation Research Program
SEMAN2;2006;Econophysics and Sociophysics: Trends and Perspectives
SEMAN2;2022;Budgetierung in Organisationen-heftig umstritten und heiß geliebt fur das Masterseminar im Wintersemester 2022/2023 Better budgeting or beyond budgeting? In: Measuring Business Vol. No. pp
SEMAN2;2013;Encyclopedia of natural hazards
SEMAN2;1970;Research in education
SEMAN2;2016;Bond Spreads and Economic Activity in Eight European Economies
SEMAN2;2021;Parallel Session Abstracts
SEMAN2;2021;DATA ANALYSIS METHODS FOR SOFTWARE SYSTEMS
SEMAN2;1981;Posterior odds ratios for regression hypotheses: General considerations and some specific results
SEMAN2;2001;Probability, Random Signals, and Statistics
SEMAN2;2019;Conceptual associations guide social inference
SEMAN2;2003;Diagnosing Strep Throat in the Adult Patient: Do Clinical Criteria Really Suffice?
SEMAN2;2017;Annals for Hospitalists Inpatient Notes-Research Highlights From Hospital Medicine 2017
SEMAN2;2017;and CD44 Immunoexpression in Primary Central Nervous System Lymphoma, and Comparison with Nodal and Extranodal Diffuse Large B-Cell Lymphoma Expression of Sonic Hedgehog Signaling Pathway Related
SEMAN2;2012;CONSUMER LIFESTYLE INFLUENCE OF CONSUMER BEHAVIOUR WITH REFERENCE TO AUTOMOBILE INDUSTRY IN CHENNAI
SEMAN3;2025;AI for Wildfire Management: From Prediction to Detection, Simulation, and Impact Analysis-Bridging Lab Metrics and Real-World Validation
SEMAN3;2024;Trending and emerging prospects of physics-based and ML-based wildfire spread models: a comprehensive review
SEMAN3;2023;GIS, AI, and Environmental Data in Fire Susceptibility Mapping: A Survey
SEMAN3;2023;Spatial Prediction of Wildfire Susceptibility Using Hybrid Machine Learning Models Based on Support Vector Regression in Sydney, Australia
SEMAN3;2023;Deep Learning Approaches for Wildland Fires Using Satellite Remote Sensing Data: Detection, Mapping, and Prediction
SEMAN3;2025;Challenges and Opportunities in Remote Sensing-Based Fuel Load Estimation for Wildfire Behavior and Management: A Comprehensive Review
SEMAN3;2020;Comparisons of Diverse Machine Learning Approaches for Wildfire Susceptibility Mapping
SEMAN3;2020;A review of machine learning applications in wildfire science and management
SEMAN3;2015;A Survey on Landslide Susceptibility Mapping Using Soft Computing Techniques
SEMAN3;2020;Wildfire susceptibility mapping via machine learning: the case study of Liguria Region, Italy
SEMAN3;2024;Non-negative matrix factorization (NMF) in fire susceptibility
SEMAN3;2018;Susceptibility mapping of gully erosion using GIS-based statistical bivariate models: a case study from Ali Al-Gharbi District, Maysan Governorate, southern Iraq
SEMAN3;2021;Wildfire susceptibility assessment: evaluation of the performance of different machine learning algorithms
SEMAN3;2023;Geostatistical Modeling of Wildfire Occurrence Probability: The Case Study of Monte Catillo Natural Reserve in Italy
SEMAN3;2020;Wildfire spreading across the urban area: definition and mapping of vegetation connectivity
SEMAN3;2018;Digital soil mapping for fire prediction and management in rangelands
SEMAN3;2018;Digital soil mapping for fire prediction and management in rangelands
SEMAN3;2024;Landslide Prediction Validation in Western North Carolina After Hurricane Helene
SEMAN3;2026;Forest Fire Environmental Drivers and Predictive Modeling Approaches
SEMAN3;2014;Large-scale risk mapping of an eruptive bark beetle-Importance of forest susceptibility and beetle pressure
SEMAN3;2014;Large-scale risk mapping of an eruptive bark beetle-Importance of forest susceptibility and beetle pressure
SEMAN3;2019;Assessment of Landslide Susceptibility Using Statistical-and Artificial Intelligence-Based FR-RF Integrated Model and Multiresolution DEMs
SEMAN3;2026;Systematic Literature Review of Graph Neural Networks in Disaster Management: Methods, Applications, and Future Directions
SEMAN3;2024;Evaluating the Impact of Recursive Feature Elimination on Machine Learning Models for Predicting Forest Fire-Prone Zones
SEMAN3;2024;Advances in retrogressive thaw slump research in permafrost regions
SEMAN3;2024;Melioidosis in India: Epidemiological Insights and Predictions from 20-Year Review of Literature with Note on Inclusive Capacity Building
SEMAN3;2004;LANDSLIDE HAZARD AND RISK MAPPING-A REVIEW AND CLASSIFICATION
SEMAN3;2020;Mapping insecticide resistance in mosquitoes to aid malaria control
SEMAN3;2002;The allelic architecture of human disease genes: common disease-common variant.or not?
SEMAN3;2014;An Overview of Information Hiding in H.264/AVC Compressed Video
SEMAN3;2017;How well has the spread of sudden oak death been predicted by the models in northern California
SEMAN3;2020;Characterizing spatial patterns of pine bark beetle outbreaks during the dry and rainy season's in Honduras with the aid of geographic information systems and remote sensing data
SEMAN3;2014;Mapping disturbance interactions from earth and space: insect effects on tree mortality, fuels, and wildfires across forests of the Pacific Northwest
SEMAN3;2021;The Association for Women Geoscientists
SEMAN3;2010;Etats dangereux et troubles psychiques: images et realites
SEMAN3;2020;The quest for measuring myelin with MRI-An interactive meta-analysis of quantitative comparisons with histology
SEMAN3;2010;Measuring Vulnerability to Natural Hazards: Towards Disaster Resilient Societies by J. Birkmann
SEMAN3;2010;[Dangerous states and mental health disorders: perceptions and reality]
SEMAN3;2013;Sickle-cell disorders: limits of descriptive epidemiology
SEMAN3;2012;Fire & Materials, 31 Jan-2 Feb 2011, San Francisco, CA COMPUTER MODELLING OF WILDLAND-URBAN INTERFACE FIRES
SEMAN3;1986;The role of space borne imaging radars in environmental monitoring: Some shuttle imaging radar results in Asia
SEMAN3;2005;Review of "Bioterrorism: Mathematical modeling applications in homeland security" by H. T. Banks and C. Castillo-Chavez
SEMAN3;2013;Encyclopedia of natural hazards
SEMAN3;2021;Parallel Session Abstracts
SEMAN3;2021;DATA ANALYSIS METHODS FOR SOFTWARE SYSTEMS
SEMAN3;2017;Annals for Hospitalists Inpatient Notes-Research Highlights From Hospital Medicine 2017
SEMAN3;2010;Risk analysis VII: simulation and hazard mitigation-&, Brownfields V: prevention, assessment, rehabilitation and development of Brownfield Sites
SEMAN3;2012;Genetics Dissection of Complex Traits in the Genomic Era
SEMAN3;2008;Recent Publications of the Pacific Northwest Research Station First and Second Quarters, 2008
SEMAN3;2006;Potential impact of climate change and water resources development on the epidemiology of schistosomiasis in China
SEMAN4;2023;GIS, AI, and Environmental Data in Fire Susceptibility Mapping: A Survey
SEMAN4;2025;AI for Wildfire Management: From Prediction to Detection, Simulation, and Impact Analysis-Bridging Lab Metrics and Real-World Validation
SEMAN4;2020;Comparisons of Diverse Machine Learning Approaches for Wildfire Susceptibility Mapping
SEMAN4;2024;A Systematic review of machine learning based landslide susceptibility mapping
SEMAN4;2025;Systematic Review of Post-Wildfire Landslides
SEMAN4;2023;A review on landslide susceptibility mapping research in Bangladesh
SEMAN4;2023;Spatial Prediction of Wildfire Susceptibility Using Hybrid Machine Learning Models Based on Support Vector Regression in Sydney, Australia
SEMAN4;2025;Challenges and Opportunities in Remote Sensing-Based Fuel Load Estimation for Wildfire Behavior and Management: A Comprehensive Review
SEMAN4;2021;Experts' multiple criteria evaluations of fuel management options to reduce wildfire susceptibility. The role of closer knowledge of the local socioeconomic context
SEMAN4;2023;Badland erosion susceptibility mapping using machine learning data mining techniques, Firozkuh watershed, Iran
SEMAN4;2020;A review of machine learning applications in wildfire science and management
SEMAN4;2024;A Novel Dataset Replenishment Strategy Integrating Time-Series InSAR for Refined Landslide Susceptibility Mapping in Karst Regions
SEMAN4;2015;A Survey on Landslide Susceptibility Mapping Using Soft Computing Techniques
SEMAN4;2024;Automated Underground Mapping of Buried Utilities: A Review of Robotic Solutions and Sensor Technologies
SEMAN4;2023;How the recursive feature elimination affects the SVM and RF for relative wildfire susceptibility in a certain area? A study case in Northern Iran
SEMAN4;2018;Susceptibility mapping of gully erosion using GIS-based statistical bivariate models: a case study from Ali Al-Gharbi District, Maysan Governorate, southern Iraq
SEMAN4;2013;A Technical Survey of Various Methodologies for Landslide Susceptibility Mapping and Hazard Analysis
SEMAN4;2021;An assessment of data mining and bivariate statistical methods for landslide susceptibility mapping
SEMAN4;2011;Landslide Susceptibility Mapping: Literature Review and Findings
SEMAN4;2023;Geostatistical Modeling of Wildfire Occurrence Probability: The Case Study of Monte Catillo Natural Reserve in Italy
SEMAN4;2020;Wildfire spreading across the urban area: definition and mapping of vegetation connectivity
SEMAN4;2024;Relevance theory for mapping cognitive biases in fact-checking: an argumentative approach
SEMAN4;2017;Landslide susceptibility mapping in Bijar city, Kurdistan Province, Iran: a comparative study by logistic regression and AHP models
SEMAN4;2020;Mapping landslide susceptibility at the Three Gorges Reservoir, China, using gradient boosting decision tree, random forest and information value models
SEMAN4;2017;Mining geohazards susceptibility and risk mapping: The case of the Amyntaio open-pit coal mine, West Macedonia, Greece
SEMAN4;2025;A review of various analytical techniques for estimating subsurface heat flow regimes from aero-geophysical data
SEMAN4;2023;The landscape of drug resistance in Plasmodium falciparum malaria in the Democratic Republic of Congo: a mapping systematic review
SEMAN4;2023;Riverside Landslide Susceptibility Overview: Leveraging Artificial Neural Networks and Machine Learning in Accordance with the United Nations (UN) Sustainable Development Goals
SEMAN4;2025;Post-wildfire debris flow in the Northwestern Italian Alps: description and numerical analysis of the June 2018 Bussoleno event
SEMAN4;2023;How the recursive feature elimination affects the SVM and RF for wildfire modeling? A mountainous case study area
SEMAN4;2023;Forest fuel type classification: Review of remote sensing techniques, constraints and future trends
SEMAN4;2021;Endemicity of Paragonimus and paragonimiasis in Sub-Saharan Africa: A systematic review and mapping reveals stability of transmission in endemic foci for a multi-host parasite system
SEMAN4;2018;Mapping insecticide resistance in Anopheles gambiae (s.l.) from Cote d'Ivoire
SEMAN4;2021;Evolving Phishing Email Prevention Techniques: A Survey to Pin Down Effective Phishing Study Design Concepts
SEMAN4;2018;Presentation of RFFR New Ensemble Model for Landslide Susceptibility Assessment in Iran
SEMAN4;2019;Assessment of Landslide Susceptibility Using Statistical-and Artificial Intelligence-Based FR-RF Integrated Model and Multiresolution DEMs
SEMAN4;2014;Wind erosion susceptibility of European soils
SEMAN4;2013;Development and implementation of a landslide susceptibility zoning system for the UK rail network
SEMAN4;2019;Development and implementation of a landslide susceptibility zoning system for the UK rail network Developpement et mise en œuvre d'un systeme de zonage de susceptibilite aux glissements de
SEMAN4;2017;Application of Remote Sensing Technologies for Assessing Planted Forests Damaged by Insect Pests and Fungal Pathogens: a Review
SEMAN4;2004;LANDSLIDE HAZARD AND RISK MAPPING-A REVIEW AND CLASSIFICATION
SEMAN4;2021;Survey of MRI Usefulness for the Clinical Assessment of Bone Microstructure
SEMAN4;2026;Systematic Literature Review of Graph Neural Networks in Disaster Management: Methods, Applications, and Future Directions
SEMAN4;2026;Targeting Simulium Vectors to Accelerate Control of Onchocerciasis in the Mahenge Area, Tanzania: A Systematic Review
SEMAN4;2020;Mapping insecticide resistance in mosquitoes to aid malaria control
SEMAN4;2024;Evaluating the Impact of Recursive Feature Elimination on Machine Learning Models for Predicting Forest Fire-Prone Zones
SEMAN4;????;Review on Applications of LiDAR Mapping Technology to Geosciences
SEMAN4;2026;Integrating geomorphological and socio-spatial factors for landslide risk zonation in Atenas, Costa Rica
SEMAN4;2023;The adoption of climate-smart agriculture to address wildfires in the Maya Golden Landscape of Belize: Smallholder farmers' perceptions
SEMAN4;1996;Human type 1 diabetes and the insulin gene: principles of mapping polygenes
SEMAN4;2015;Comparison of Logistic Regression and Random Forests techniques for shallow landslide susceptibility assessment in Giampilieri (NE Sicily, Italy)
SEMAN4;2024;Advances in retrogressive thaw slump research in permafrost regions
SEMAN4;2021;Digital Elevation Models of Rockfalls and Landslides: A Review and Meta-Analysis
SEMAN4;2018;Geological hazards in the UNESCO World Heritage sites of the UK: From the global to the local scale perspective
SEMAN4;2020;Susceptibility assessment of human-leopard conflict in Aravalli landscape of Haryana using geospatial techniques
SEMAN4;2024;Landslide Prediction Validation in Western North Carolina After Hurricane Helene
SEMAN4;2015;Atop Gallows Hill: magnetic susceptibility in archaeological reconnaissance
SEMAN4;2002;The allelic architecture of human disease genes: common disease-common variant.or not?
SEMAN4;2021;Geologic Terrain Analysis, Geomorphic Mapping in Support of Infrastructure Development
SEMAN4;2022;Date of publication xxxx 00, 0000, date of current version xxxx 00, 0000
SEMAN4;2016;Mapping the spatial configuration and severity of giraffe skin disease in Ruaha National Park, Tanzania
SEMAN4;2012;Landslide inventory maps: New tools for an old problem
SEMAN4;2017;Capturing digital data with handheld devices to determine the redox regime, lithology, and provenance of siliciclastic sediments and residual deposits-a review and field manual
SEMAN4;2014;Mapping disturbance interactions from earth and space: insect effects on tree mortality, fuels, and wildfires across forests of the Pacific Northwest
SEMAN4;2019;Spatial Modeling of Gully Erosion Using Linear and Quadratic Discriminant Analyses in GIS and R
SEMAN4;2002;Progress and problems in defining susceptibility genes for rheumatic diseases
SEMAN4;????;The Association for Women Geoscientists
SEMAN4;2007;Genetic basis of murine lupus nephritis
SEMAN4;2021;Applications of Proximal and Remote Sensing Technologies for Soil Investigations Symposium
SEMAN4;2013;Abstract ED02-02: Interaction between genetics, epigenetics, and environment in cancer prevention
SEMAN4;1987;Magnetic method applied to mineral exploration
SEMAN4;2010;Measuring Vulnerability to Natural Hazards: Towards Disaster Resilient Societies by J. Birkmann
SEMAN4;2021;Geophysical Reconnaissance for Siting Dryland Critical-Zone Monitoring Experiments in Southern New Mexico, USA
SEMAN4;2020;The quest for measuring myelin with MRI-An interactive meta-analysis of quantitative comparisons with histology
SEMAN4;2015;Asset Management Tools for Municipal Infrastructure Considering Interdependency and Vulnerability
